Unnamed: 0,labels,headline,__index_level_0__
13229,1,shit parking ticket fuck,13203
11419,1,baby boring,6862
8458,2,hbo presentation fails to deliver promised 'brief nudity',11347
13451,0,magical gallery transforms dull objects into art,8022
9854,2,prison now allowing death row inmates to receive weekly visitors throughout executions,11892
506,2,omarosa searches through tapes of everyone else in white house using n-word for one of trump,877
11434,0,newspapers piling up on dead homeowner's doorstep,12517
13507,1,"father-in-law think tank issues comprehensive one-sentence solution to immigration, unemployment, crime problems",196
13490,1,man at very top of food chain chooses bugles,13286
5127,1,just area man's luck,3383
6953,2,america's love affair with jim breuer to start any day now,4379
3343,1,terrible artist thinks latest piece really represents a culmination of everything he's been working toward all his life,9406
9588,2,history channel repeats itself,11784
4415,0,hometown wistfully toured via google street view,2997
6118,0,report: shame of walking out without buying anything drives 90% of purchases at small businesses,3908
3654,2,"americans urged to get saving $30,000 out of way before obamacare repealed",2571
3587,0,grieving nation solemnly waits extra day for their amazon shit,9514
9536,2,more americans falling for 'get rich slowly over a lifetime of hard work' schemes,11767
12148,2,white house increases number of asylum seekers allowed to enter spike-filled refugee compactor,12778
12864,0,police say conditions too nippy to rescue missing hiker,13059
9336,1,glorious heyday of youth spent in parking lot,5721
7972,2,media condemns julian assange for reckless exposure of how they could be spending their time,4969
7520,0,giant altoid heading toward earth,4711
6594,1,record-store clerk gazes down from on high in aloof indifference,4163
12415,0,woman who visited kenya once struts confidently into african store,13528
1761,1,fans disappointed to learn 'fast five' contains no car-chase scenes,8806
5510,2,unemployed man who had to move back in with his parents still for obama,10239
3844,0,lowe's introduces 2-way ladder user can also climb down,2682
1205,0,article about one world trade center building includes paragraph explaining 9/11,8585
3551,1,annoying coworker insists on existing right in visual range,2508
11221,2,gop candidates offered cash voucher to give up spot and participate in later election,6745
1694,0,classic movie 'avatar' updated for today's audiences,1510
6840,2,trump called up for vietnam service after last of draft deferments expires,4314
7288,0,rising income inequality causing wealthy americans to take on second sailboat,10919
12170,1,law school applications increase upon realization that any fucking idiot can be lawyer,7301
8668,2,american airlines announces it will no longer try to match seatmates by interests,5356
9776,0,prick veterinarian keeps dachshund waiting in empty lobby for 45 minutes,5972
1186,1,area man expected to work with these incompetents,1244
11180,0,tractor-pull fans begin to question whether this is what life is really about,12430
13337,2,bush asks advice for this friend of his who invaded iraq,7949
10198,0,scientists announce discovery of dry ice on mars means planet may one day be suitable for halloween party,12022
6524,2,more americans putting off marriage until ultimatum,4121
9194,2,jfk jr. announces plans to run for best-dressed man in '98,11638
8017,2,nation's liberals not sure what to think after hearing special counsel has waterboarded every suspect in trump investigation,4995
4561,0,all u.s. males renamed dudley,9877
11702,2,hungover guillermo del toro panics after realizing he promised to write new movie for everyone at oscars after-party,7033
2384,0,tammys of the world demand to be taken seriously,1876
43,0,standards lowered for second search through fridge,8137
8502,2,mccain clinches religious vote with stirring high-register rendition of 'ave maria',5262
2037,1,variety of unsustainable business models make up extremely hip neighborhood,254
11316,2,q forced to resign from department of agriculture for improper filing of expense reports,6802
7179,1,"parents, baby, godmother all uncomfortable with arrangement",4511
4057,1,man strains to find personalities in pet fish,9672
8313,2,fresca quietly takes control of 18-34 demographic in daring overnight raid,5159
11044,2,seating mix-up puts tony bennett in middle of slipknot,12375
298,1,genetics emphatically deny playing any part in area man's body,759
8909,0,free toothpick transforms schlubby restaurant-goer into aloof bad boy,5481
97,0,fire department deploys unmarked trucks,654
8562,0,doctor asks new mother if she'd like to keep newborn's exoskeleton,5297
9499,1,extra strip of wrapping paper taped over present's weird edge,5812
8547,0,backstreet boys become backstreet men in backstreet ritual,5288
4218,1,tulip popping up in middle of march must think it some kind of hotshot,2892
5154,1,bachelorette party saved by actual firemen,3401
9183,2,'new york times' announces new columnist will contribute nothing to society 3 times a week,5636
1528,0,latest austin powers movie opens in theaters,1420
4500,2,"scalia recuses self from capital murder case, citing double homicide he committed in '80s",3044
4097,0,fda recommends at least 3 servings of foods with word 'fruit' on box,2830
2874,2,mentally unbalanced man still waiting for the right trump comment to incite him,9226
7996,1,songs that are always on in background expected to win big at grammys,328
12278,0,hippocratic oath updated to include vow of loyalty to blue cross blue shield,13525
1748,2,"single, unemployed mother leeching off government",253
10833,0,nba ref petrified after seeing depiction of own death while looking under replay hood,12290
10102,1,report: double stuf oreos could raise tolerance to stuf,6159
8613,1,playstation classic to include friend who always whooped your ass to complete retro gaming experience,5323
4035,1,area man crawling on ground like pig to plug macbook power cord behind desk,9661
6947,2,arne duncan stressed about preparing for standardized secretary of education exam,4377
9868,2,magazine article about mindy kaling fails to mention she's a woman,6022
8196,1,"area woman not a morning, afternoon, or night person",5092
8705,1,fourth verse of christmas carol gets super religious,5377
4455,1,floppy-armed robot repeatedly warns: 'danger',3019
4472,2,rob schneider lands role originally written for chimp,3029
3769,0,magical voting booth transforms clearheaded americans into reactionist morons,2636
3567,1,cow excited to freak the fuck out during solar eclipse,9507
963,0,coach angry every player gets a trophy,1131
4454,0,3m introduces new line of protective foam eye plugs,3018
4331,0,burmese python shocked at amount of stress man holding in his neck,2945
5658,2,"michele bachmann figures why not, introduces homosexual-beheading bill",3659
3991,2,oscars gift bag includes 3 ipads streaming telecast in attempt to shore up viewership numbers,9648
3851,0,celebrity 'caught' smoking,9602
12792,1,brutal reality check turns three,7655
3812,0,domino's introduces thanksgiving feast pizza,2663
11354,0,"'try it now,' shouts gogo internet technician standing on plane wing while fixing in-flight wireless connection",12485
8706,0,fire hydrant blows load all over hot neighborhood kids,5378
11820,0,new okcupid feature alerts users when it's time to come crawling back,7095
1409,0,christian pornographer refuses to film sex tape for gay couple,1362
5681,0,military-industrial complex recalls coming together in aftermath of 9/11,10304
8996,1,military recruiter doesn't have to dig too far into bag of tricks to land this one,5533
5315,1,showers with girlfriend increasingly cleansing-focused,3481
13065,0,nation's dogs vow to keep their shit together during 4th of july fireworks,13132
10290,2,wilbur ross shakes self awake after briefly dying during cabinet meeting,6255
4855,1,family unsure why grandmother's caregiver seems like he actually enjoys spending time with her,9990
12968,2,troubling report finds millions of americans forced to make ends meet by getting up and going to work every day,7745
8968,2,"depraved candidate struggling to support $100,000-a-day advertising habit",11558
8231,1,"after 10 months of bitter struggle, downstairs neighbor masters 'jumpin' jack flash'",5112
9721,1,son's friend the kind who always gets nosebleeds,5940
10205,0,transit authority pledges to double number of out-of-service buses by 2006,12028
987,2,authorities praise twitter users' rapid response to virginia shooting,8496
2890,2,mtv shifts focus to youth,9234
4195,2,john boehner calls for national guard to deal with illegal immigrants hiding in mexico,2880
9546,0,amazing 'human fly' lives off diet of garbage,5839
5125,1,tv executive claims to be looking for edgy,3381
8638,0,supercuts ceo apologizes for number of customers scalped every month,11416
1294,0,internet collapses under sheer weight of baby pictures,1302
13136,1,college professor reminds students it will take a few classes to memorize everyone's triggers,7839
7953,2,senate unable to get enough republican votes to honor 'to kill a mockingbird',4957
7749,1,man feeling pressure to live up to conversation between barber and customer in next chair,4836
7541,2,spooked rubio staffers drive slowly past abandoned jeb bush campaign headquarters,11009
13528,1,city adds some big concrete stairs,13297
1464,2,screwball jim nabors goofs up again by marrying man,8692
9335,1,townsfolk strongly prefer man's werewolf incarnation,5720
11195,1,bald man just going to have to accept entire head will turn bright red from time to time,6730
3184,0,the onion apologizes,9355
632,0,high school elects gay 45-year-old homecoming king for first time in school history,942
12291,2,44 suspicious packages detonated under white house christmas tree,12836
4869,2,man who spent last 2 years drawing pictures of trump and putin making out beginning to realize just how wrong he's been,3235
4915,0,vanquished foe's skull makes surprisingly bad wine goblet,3257
5706,0,husband apologizing in sleep,10319
5146,0,butterfly on ankle marks passage into womanhood,10090
6384,1,pigeon to invoke power of flight,176
3215,1,historical archives: two feared dead in near-by child-birth,435
10894,2,emotional wayne lapierre honors victims of background checks,6556
5624,2,excited mike pence assures john mccain he has his 'last rites' kit ready to go just in case,308
1802,0,dixieland band evicted,1565
6222,1,5-year-old reluctantly lets crying mom sleep in his bed again,3964
2827,2,eric trump aims laser pointer at don jr. while flicking lights on and off to erase memory of russia meeting,2135
359,2,facebook: 'identifying hate speech is difficult because some posts actually make pretty interesting points',8255
10045,2,"nation's women clarify they harbor no secret desire to see colleagues', acquaintances', strangers' genitals",11972
716,2,bob dole for windows to replace bob dole 4.0,8403
7989,0,world gets first-ever look inside greenspan fantasy ranch,4977
12677,1,woman's primal instincts activate to protect nearly finished glass of wine from approaching server,7591
7973,0,fans of victorious nobel laureates riot in stockholm,11161
3377,0,"stan lee, creator of beloved marvel character stan lee, dead at 95",595
154,2,"pope john paul ii, longtime owner of popemobile, dead at 84",13545
7368,2,u.s. soothes upset netanyahu with shipment of ballistic missiles,4625
744,0,study: 83% of web content unfit for human consumption,8416
8623,0,concert security guard would willingly give his life to protect coldplay,5332
2809,0,alien still hasn't gotten around to listening to whole voyager golden record,9195
3010,0,overpopulation of the earth: will it create valuable new markets?,9285
8431,1,anchor ad-libs news with 97 percent accuracy,11341
3749,2,thousands of new orleans households still without political power,2623
1624,2,"north korea claims new long range missile has ability to fly right up in the air, not unlike a bird or a fly",8761
7281,0,biologists confirm foxes sneakiest little fuckers in animal kingdom,4572
5748,2,cnn technicians rush to empty wolf blitzer's urine tank midway through election coverage,10336
11348,2,man can't get police to care about his bob crane murder theory,12482
4706,1,david byrne holds up old suit to show how far he's come in weight loss journey,231
13612,1,report: store out of good kind,179
10935,1,study: retired dads busier than ever,6584
256,2,governor too embarrassed to say which state he leads,737
12986,1,college senior holding out hope that internship will lead to class-action lawsuit,13106
12146,2,heartbroken russian ambassador thought special meetings with jeff sessions were very memorable,7289
4828,1,"sick, elderly man screaming about foreigners stealing from him",9981
6040,2,"new 'game of thrones' teaser shows cackling, power-mad george r.r. martin burning completed 'winds of winter' manuscript",3865
9586,2,david cameron to scottish people: 'i'll kill myself if you leave',5865
9941,1,neighborhood starting to get too safe for family to afford,6057
13040,1,couple nervous to admit they met online in comments section of 'how to iron shirt' video,7785
7889,1,"census bureau: 9,000 to 15,000 people work at census bureau",109
9305,2,"israel's, hamas' disregard for palestinian life aligning nicely",5705
12167,0,"real life ""twister"" kills 117",7298
1324,0,unpopular police officer thinking about committing racially motivated offense for a little support,1321
9712,2,cory booker tries to relate to rural voters by mangling hand in grain auger,5935
2590,2,breitbart traffic down as readers now getting bulk of news analysis from graffiti scrawled across neighborhood,1995
10768,1,new babysitter can already tell this kind of kid who gets naked for no reason,6495
12208,2,house inappropriations committee suggests nation's women dress a little sexier,12806
11433,2,"trump promises u.s. will continue to recognize, preserve palestinians' historic refugee camps",6872
12926,1,rest of evening spent declaring asshole not going to ruin evening,7724
11884,0,suicide note makes convincing case,7131
377,1,asshole from plane greeted at baggage claim by whole family,800
5705,0,parking lot attendant seemingly unaware new day a gift from god,10318
2733,0,endangered wildlife to be given new identities in species protection program,2086
8945,0,researchers publish list of ways animals can help fight climate change,5501
10181,2,shocked 'our planet' viewers watch as david attenborough enters scene to break neck of starving polar bear,6200
1456,1,couple discovers shop that sells cakes,8688
11236,1,opera ends on unexpected high note,69
8690,2,christian bale loses 40 years for upcoming movie role,5367
13128,0,jury selection proving difficult in trial of 'the jury killer',13156
9272,1,"according to bar love-tester, inebriated patron okay to drive",5682
13372,2,u.s. general jealous that syrian army allowed to attack citizens,7971
2905,0,new smithsonian exhibit honors thousands of pets who joined workforce after owners left to fight in world war ii,9239
8332,0,'better homes & gardens' puts first plus-sized succulent on september cover,5170
2008,0,norad takes area vagina to femstat 3,1680
1929,1,pantone intern starstruck after meeting designer behind sand dollar 13-1106,377
1622,0,npr listener acquires kick-ass tote bag,1469
9759,0,archaeologists unearth ivory trumpet dating back to prehistoric jazz age,5961
3719,2,secretary of education reveals she's forced to use own salary on yacht supplies,2603
6629,1,area 31-year-old can't believe 'you must be born before this date to buy cigarettes' sign up to 1982,4181
289,0,pallbearers carry leslie nielsen's coffin without incident,8229
13249,0,baskin-robbins' cash register interface just big button for ice cream,7897
6358,0,scientists put sleep-inducing power of agribusiness today into pill,10585
12435,0,depleted hawaiian volcano now just coughing up bile,12894
7171,1,10th-grade prodigy studying mathematics at 10th-grade level,4505
6165,2,"'no way to prevent this,' says only nation where this regularly happens",10507
6717,1,nation's cuckolded husbands gear up for first day of hunting season with wives' lovers,4230
11017,2,national weather service: 'don't go surfing unless you can really shred that shit',12361
4587,2,clinton pours malt liquor on ground for dead homies,3091
3915,0,college encourages lively exchange of idea,2726
13191,1,bear emerges from hibernation refreshed and ready to kill,477
1336,2,alan colmes' death goes unreported on hannity & colmes,1329
3124,0,russian man just pretending meteor shower the reason he's bleeding from face,2283
5810,0,fraternity members to undergo racial sensitivity hazing,3732
13120,1,woman checks terror-alert level before leaving for work,13151
9609,1,"study finds placing one foot forward, then the other, remains best method of walking",5873
3352,2,ruby tuesday goes public with request that everyone come on down to ruby tuesday,9411
286,2,bush introduces new timmy blanchard left behind act,751
12268,2,"marine determined to win heart, mind of at least one iraqi",12826
12790,1,child's favorite restaurant also dad's favorite bar,7653
11641,0,paul hogan keeps pitching crocodile dundee saturday-morning cartoon,12590
500,1,dad finally found in front of tvs at sears,873
10996,1,of course busy bartender doesn't mind taking picture of you and your friends,6620
12445,2,bob barker era ushered out with touching plinko montage,7453
2068,0,local hamburger to star in national ad,8928
1972,0,god recalls collaborating on joint vision of humanity with deceased creative partner,8888
7269,0,nation's sound engineers gather to talk about their ponytails,4564
1757,2,nation's stomach ulcers predict trump administration will provide opportunities for unlimited growth in 2017,1545
263,2,inconsolable sarah palin opens up about sacha baron cohen betrayal to cardboard cutout of whoopi goldberg,739
9291,2,texas executes 393rd guilty prisoner,11676
3846,1,new dog sick of being compared to old one,2683
11694,0,detroit burned down for the insurance money,12609
5083,0,new stem education initiative inspires girls to earn less than men in scientific career,10070
8244,2,curt schilling just going to assume he has speaking slot at rnc,5121
2473,0,tumbleweed of pubes rolls through desolate dorm bathroom,9072
5394,2,nation too terrified to look at what trump's recent rise in polls attributed to,3518
11120,1,what mom would have wanted evolving over course of funeral planning,6682
3257,0,man who keeps keys on carabiner must rappel into office building every morning,2354
8854,2,amc bob hope retrospective ready to go,11514
6607,0,bird's nest 65 percent cigarette butts,10684
325,0,grocery-store freezer's white castle section a wreck,773
5107,0,goth kid builds scary-ass birdhouse,10080
10193,0,relationship experts recommend single women try bathing in open stream until suitor glimpses them through trees,12020
8392,1,guy just trying on shirt right in middle of store,5200
6925,2,california to allow prisoners to serve sentences online,10783
73,1,annoyed movers weren't expecting client to have belongings,641
13267,1,wistful woman wonders if this could be the one she'll sleep with for few weeks before losing interest,7912
12377,2,could hillary clinton have what it takes to defeat the democrats in 2008?,7420
4020,1,black guy doesn't talk about all the times he didn't get discriminated against,9656
4796,1,family has way too many daughters for them not to have been trying for son,3203
6833,2,"new cheney memoir reveals he's going to live full, satisfied life without ever feeling remorse and there's nothing we can do about it",4309
8398,0,new dog digs up old dog,5204
10278,2,sex scandal sinks klemke reelection bid,6249
484,2,"nude, ash-streaked dick vitale proclaims this what march madness all about",865
8972,1,man's ironclad grasp of issue can withstand 2 follow-up questions,5516
1600,0,hot new 'murder craze' sweeps chicago,8750
12837,2,doctors restore ken burns' full-color vision after removing massive tumor from filmmaker's visual cortex,13045
1537,0,partially faded hand stamp undermining everything prosecutor says,8722
9497,2,"pakistani boy, u.s. drone form unlikely friendship",13479
10296,2,exxonmobil ceo depressed after realizing earth could end before they finish extracting all the oil,12066
11831,1,soldier back home from serving at mexico border still having nightmares about being used as political prop,13520
10110,1,home-schooled student opens fire on breakfast nook,13488
672,2,nation throws off tyrannical yoke of moderate respect for women,962
12876,0,reporter for high school newspaper most professional journalist in nation,13060
5206,2,hillary clinton threatened by black man,10109
2797,1,wal-mart greeter knows exactly how many blacks in store,9189
12855,2,g7 unable to get deposit back on shipment of 'g8 summer getaway' t-shirts,13056
9731,2,desperate 'time' magazine announces 'man of june',11841
11545,1,conversations pretty limited when friend not in midst of crisis,6945
5011,1,tourists not leaving landmark until all permutations of groups and cameras exhausted,3309
2893,1,every day of local dad's life an endless battle to hold on to good pen,2166
2174,0,loyal dog waits 2 full hours before consuming dead owner's face,363
6125,2,baltimore residents urged to stay indoors until social progress naturally takes its course over next century,10489
5790,2,macaulay culkin hoping some 'funny or die' writer comes up with video idea for him,3723
4089,2,escalating tensions lead trump to shake up inner circle of tv programs,2825
10304,1,news anchor wonders where all these great stories come from,12071
5538,2,wealthiest americans ominously remind nation they could easily drop another $10 billion on election,3597
7549,2,gop attacks christine blasey ford for never coming forward to testify,4726
1377,0,pier 1 imports unveils new self-defense vase for smashing onto head of home invader,546
4321,1,"lifeguard would save drowning man, but who is he to play god?",2940
919,2,obama urges young voters to ignore how many lousy candidates democratic party runs,471
1941,0,weakling president asks imaginary man in sky to bless nation,1641
13441,2,"'i can't do this again,' shaking, sweating donald trump says after nervously vomiting before rally",8014
5053,2,terry gilliam barbecue plagued by production delays,3338
12818,2,clinton dragged up on stage to sing 'sweet home alabama' with the band,7669
1050,1,area man fantasized about for one and only time in his life,1172
1132,2,netflix gently reminds 'arrested development' fans that new episodes of the show won't actually solve world's problems,8557
8523,2,"'how could harvey weinstein get away with this?' asks man currently ignoring sexual misconduct of 17 separate coworkers, friends, acquaintances",5273
11104,1,area dad off to bad start with waitress,6672
9986,2,"bernie sanders refuses flashy abc podium in favor of own humble, homemade lectern",6085
4023,1,thursday cry moved up to wednesday due to scheduling conflict,9657
11139,2,trump unable to produce certificate proving he's not a festering pile of shit,6697
9424,0,report: turkey sandwiches an excellent source of turkey sandwiches,11717
3241,0,video game character stares impotently at forbidden realm beyond impassable waist-high bush,9376
5098,2,nation excited to see whatever bile the internet spews up today,3364
11337,2,bush trying to decide how to spend his tax refund,6818
13023,0,new louisiana abortion law requires fetuses be given jazz funeral march through the french quarter,13120
2677,1,child assured it will be long time before he dies,13380
1510,2,ted cruz worried all the good countries to wall off taken by other candidates,1410
1229,0,new evidence suggests humans may have been dipping crunchy things into gooey things earlier than previously thought,8594
3827,0,surgery required for new sexual position,9592
11094,1,no clear winner in feces-throwing conflict,6666
11566,0,"department of interior employee caught embezzling 50,000 wolves",6959
5276,0,grandma knitting escape ladder,10140
3865,1,waitress who took over at table just doesn't have same spark as richard,2694
406,0,tank rolls by living room window,815
10779,0,lovebird windshield wipers gleefully chasing each other through rain,6500
2815,0,nesting sea turtle escorted from private beach,2131
2239,1,unclear if fountain is the type you're allowed to run around in,1797
7286,0,thousands dead in wake of low-carbon diet,4575
8365,0,climatologists say humanity's best hope is hurricanes spinning in different directions and canceling each other out,5190
4646,1,every family member's birthday now marred by some tragedy,3122
9567,2,congress repairs to parlor to hear rep. carolyn maloney play the recorder,5853
8686,2,steve buscemi to make surprise guest appearance in this article,5365
315,0,10-year-old first responders rush to bike crash scene to check out tyler's fucked-up leg,8240
6778,2,jared kushner spends fourth consecutive day silently ensnared in decorative white house spider webs,4275
11712,0,"disappointing prince vaults found to contain 37,000 hours of billy joel covers",12620
4583,1,study finds goosebumps caused by psychotic weirdo masturbating to old photo of you,3089
576,1,tick happy where he is,8346
8971,0,comments mysteriously disabled on youtube video of sparrow in yard,11560
10871,0,entitled deadbeat finally breaks out of 20-year cycle of government dependency,13610
1586,2,report: john lennon probably would have eventually died anyway,8742
8485,0,entire nyc subway system now consists of single handcar,5253
1642,0,b*a*p*s rented on strength of academy award-winning stars,237
1733,2,'jurassic world 2' to feature more scientifically accurate jeff goldblum,1532
12306,0,north dakota drinks itself to sleep again,12841
11949,2,bush tearfully addresses nation after watching field of dreams,7169
