Unnamed: 0,labels,headline,__index_level_0__
6053,0,nasa celebrates 60th anniversary of launching first moon to orbit earth,3871
5907,2,joe wilson getting bored with no-longer-covert wife,3791
12665,0,scientists claim solar energy will be capable of powering 95% of scorchlands outposts by 2085,12980
8676,1,desperate catholic church now offering sainthood to anyone who regularly attends weekly mass,11434
2081,1,woman knew ever since age 40 she didn't want children,1717
3867,1,"'it's simply bursting with creative wonder,' says reviewer of new game where mario sometimes dresses as chef",2696
2336,2,pence aide encourages candidate to try some more happy-looking scowls during debate,1848
7182,2,onion social announces hiring of james damore as chief technology officer,4512
5286,0,philip morris introduces new marlboro sinus pm cigarettes,10143
11000,0,suborbital ballistic-propulsion engineer not exactly a rocket scientist,6622
5215,2,"'c'mon, c'mon,' says matt damon desperately searching for own name on list of imdb user dolphinsoul60's top 100 actors",3435
2912,0,drake's introduces new yodel bandolier,9241
3745,0,enron executives blamed for missing employee donut fund,142
3757,0,paramount home video pleased to bring man feature presentation,9570
11629,0,area mother displays extensive goya collection,6992
2825,0,"experts recommend breaking down crushing defeats into smaller, more manageable failures",9205
2221,2,lockheed martin sales staff instructed to really push tactical air-to-surface missiles this week,8991
929,2,report: limbo competition nation's last example of pure meritocracy,1117
2153,2,kavanaugh nomination falters after washington post publishes shocking editorial claiming he forgot daughter's piano recital,1756
12960,2,eric holder announces least controversial decision of tenure,497
11232,0,mcdonald's introduces new 6-piece chicken ncnoltes,6751
495,1,cat's whiskers a little much,870
5082,1,area woman always has backup problem just in case,3357
12835,2,writer unwilling to admit his screenplay perfect fit for justin long,7678
227,1,last month apparently women's history month,721
520,0,dog blocks off afternoon to lick spot on floor where owner once dropped pepperoni,886
12946,2,palestinian family trapped under rubble thrilled to hear 'gaza' trending on twitter,13090
4888,1,lapd going about day in uncomfortable silence,10009
12575,1,man's genetic predisposition for heart disease no match for 10 half-assed push-ups he does couple times a week,12940
580,2,"'yes, but how did he die?' ghoulish american public asks of recent celebrity death while rubbing delicate, bony hands together and smiling thinly",8347
13593,1,"area waitress has one hell of an ass on her, local man will tell you that right now",8102
9777,2,stuffed-up congress allocates $250 million to destroy pollen,11858
3084,1,"study finds every style of parenting produces disturbed, miserable adults",9313
1299,1,report: it would be a real shame if something were to happen to you,314
10589,2,fbi deputy director touched by heavily redacted farewell card from bureau coworkers,12193
5402,2,teen accurately describes robert mapplethorpe exhibit as 'gay',10197
6667,1,woman with sore throat thinks it might be anthrax,4204
9561,1,copy editor's revenge takes form of unhyphenated word,5850
10059,2,trump turns on fox news and tells aides to make whatever they're saying a law,6129
8851,2,officials investigating hugh hefner's death suspect foreplay,5447
4655,0,activist wet-t-shirt judge votes for girlfriend,3129
2591,2,national security commission warns clinton: 'the call is coming from inside the house',1996
5245,0,"bloody, detached hand of bears' player still in julius peppers' facemask",10127
6233,1,study: marriages between perfectly matched couples should still only last about 15 years,3968
11412,0,neil armstrong's wife glad to finally get rid of all the space hobby crap,12511
7379,1,black man bids tearful goodbye to family before daily commute,336
6935,2,jimmy buffett pays for own drink for first time in 17 years,10788
11009,1,man actually shouting at other man to get jennifer aniston romantic comedy made,12357
8855,0,art experts confirm guggenheim museum a forgery,11515
4396,2,trump spends entire classified national security briefing asking about ​egyptian ​mummies,2985
7358,2,jeff bridges seated directly behind support column at golden globes,4620
10841,2,poll finds 78% of americans would vote for liberty bell,6531
2188,2,gop convention to feature strong lineup of conservative women listeners,8972
5470,0,45% of items in woman's apartment have word 'love' written on them,3558
11173,0,new 'doctors without licenses' program provides incompetent medical care to refugees,12428
5174,1,distraught man still finding painful reminders of long-gone hoagie around apartment,3416
4154,0,department of interior brings down derelict rainbow with controlled demolition,307
12906,1,spatial skills abandon area man during search for correct tupperware lid,13532
8984,1,report: keep reading and nobody gets hurt,11563
3164,0,u.s. fish and wildlife service reintroduces straw hat-wearing boys to old fishin' holes,348
9685,0,weird al honors parents' memory with 'tears in heaven' parody,5918
12069,2,"dennis hastert fights to locate, save neck",7243
12606,2,mar-a-lago staff apologizes for letting in guest they just assumed was high-powered lobbyist trying to buy influence,12956
7133,1,"eleven-year-old has miniskirt, pumps, vague notion of what sex is",4482
370,1,enraged character in stageplay to be unconvincingly restrained by other actors,8263
2788,1,unconditional love given to 15-year-old who just called mom a bitch in middle of hollister,9185
11409,0,amazon fires warehouse worker who took unauthorized breath,6855
7783,1,kinky couple has mirror in bathroom,11100
4271,1,group of friends chanting 'shots' make compelling point,9763
11393,1,"dad wearing some new kind of headphones that wrap over, under, around ears",12500
2719,2,twitter announces there no trending topics today,9164
1981,1,cute new dog helping single man pick up tons of hot shit,1666
12660,2,turkish actor thinks he's cüneyt fucking arkin,7579
9059,1,local internet user completely unaware he a top content creator for barstool sports,5570
12122,0,yeti releases abdominable crunch workout video,52
2470,2,tomm lasorda to enjoy sensible dinner,9071
10308,1,nature films: do they glamorize molting?,6263
1567,2,arsenio hall writers still keeping in touch,1445
1724,0,wisconsin has crush on minnesota,13366
12359,0,furloughed federal employee starts online search for new government,12861
2032,1,high school kicker finds it helpful to imagine football as object that needs to be kicked through goal posts in order to gain points,1695
1819,0,thirsty mayor drinks town's entire water supply,1574
5213,0,kleenex box inadequately covered,10115
6993,1,fixin's added to food pyramid,4405
1917,2,legislators still concerned about key non-issues,1630
10457,0,jim morrison stares creepily out of apartment window,12132
2392,2,dana loesch rethinking loyalties after seeing how much airtime teen activists getting,1881
8162,1,report: only 20 minutes until introverted man gets to leave party,5074
8959,0,nurse being treated for ebola impressed with health workers' new gear,5509
10223,1,cashier learning valuable but illegal job skills,12035
4717,2,cash-strapped oklahoma to conduct executions by hammering squad,9934
4126,1,irs can't believe area man didn't get a raise last year,9699
8750,0,negligent oaf sloppily packs away board game without so much as a thought to future players,11465
5802,2,bush texting while mahmoud abbas speaks,186
9036,0,"grizzly bear sprained paw while mauling hunter, reports ranger",5558
11974,2,sasha obama suspicious after doing a little digging around on benghazi,7185
11678,2,"pentagon allocates $600,000 for actual gun used in 'scarface'",12604
6109,2,nra spokesman: a hebrew?,10484
10939,2,bo obama issues first public bark since leaving white house,6587
1165,1,report: what's a pretty lady like you doing around an article like this?,1234
3690,1,man's relationship advice same as his hunting tips,9549
6128,2,romney pledges to replace all foreign policy with jobs right here in america,3915
13631,0,internal affairs investigator disappointed conspiracy doesn't go all the way to the top,446
456,0,exhibitionist zoo elephants waiting for crowd to gather before screwing,844
8393,1,circus runaway not looking forward to hometown show,5201
13508,2,authorities urge florida residents to prevent further disasters by finally standing up to hurricane,13291
10681,0,pop culture site powering through 4 weeks of sponsored posts for movie its film critic called 'contemptible trash',12230
3408,1,dad thought he could make it out of zoo without buying kids light-up shit,2440
4614,2,george jefferson honored for black television history month,3103
12866,1,study finds majority of urban households located in roller rink deserts,7692
7632,0,airbnb host decides handwritten note necessary to protect cocktail sauce in fridge,4774
11597,2,george clooney beginning to think he should buy his own tuxedo,6974
10001,2,julian assange fired from it job at pentagon,6094
2865,1,man unsure whether to tip bathroom attendant just for wiping his ass,2153
8975,1,birthday wish wasted on trying to bring dad back,5518
7334,2,"police chief says there just a few bad, deeply ingrained prejudices giving all cops a bad name",10932
8150,1,dad apparently using spanish accent to pronounce middle eastern food now,5067
8846,0,u.s. hunger for fish byproducts not as strong as first imagined,11512
7033,1,report: universe to end next friday,10825
12927,0,jay-z gives shout-out to his shareholdaz,13618
332,2,vladimir putin begins second term as whatever he is,776
745,0,yin making inroads on yang,8417
11836,0,study finds effectiveness of medical treatment skyrockets when doctor acts like condescending dick,12670
10427,0,new prescription fish tank eliminates need for glasses while looking at fish,6324
7887,0,heirloom plasticware lovingly handed down to next hundred thousand generations,4920
9795,2,sexist media keeps only referring to woman as 'bride of isis soldier',11866
13327,0,'back to dock' voted most popular destination among current rowboat passengers,13239
3938,0,candy purchase puts yet more money in raisinets' bloated coffers,9632
4676,1,mommy having sleepover,3136
8801,2,white house begins christmas season with ceremonial lighting of cross,11488
8880,0,applebee's steak sent back for not being properly slathered,5462
4763,1,out-of-control conversation safely turned back onto self,3183
8399,2,milosevic dreams he's slaughtering ethnic albanians in his underwear,11329
12552,2,al franken pledges to make up for sexist behavior over course of next four senate terms,7522
7075,1,family fears grandmother aware of her surroundings,10842
4790,1,raccoon family tired of taking care of rabid father,3199
5746,2,fda prepares nation for switch to digital food format,10335
1268,0,copies of da vinci code litter crash site,1289
5103,1,gasoline still inexplicably cheaper than milk,13411
12766,0,u.n. aid workers distributing food to malnourished kfc customers,13014
5317,1,boss thinks female employee might be ready to handle job she's been doing for past 2 years,10157
12597,2,clinton vetoes 'stab clinton' bill,7542
2388,0,awestruck video-game fan describes brush with playstation 2,1879
10688,2,"oscars attendees cower in awe as disembodied, all-knowing voice proclaims information about nominees",12233
2547,0,express-lane cashier confirms her nails are real,9104
8869,2,every bill reminds congressman of ex-wife,5457
2858,2,daniel craig takes home pretty good actor award,2148
6543,2,u.s. asks africa not to cash aid checks until after tax day,4131
807,1,nation admits being so coked-out in '80s they have no memory of reading 'cujo',1036
1813,2,condom indicted on 400 million counts of spermicide,8828
197,0,"dad recounts amazing story of how, through quick thinking, he saved $4.27",13546
6552,0,new 'steak & onion' potato chips taste disturbingly like steak and onions,4134
89,0,marine corps shortens slogan to 'the few',649
11163,2,"'heed my tragic story well, friends, for you could just as easily be me,' says chris christie in haunting rnc speech",6711
479,0,spanx introduces new line of smoke bombs for concealing unwanted bumps and bulges,861
12068,1,roommate won't shut up about his best sound mixing oscar,191
480,1,high school history textbook concludes with little blurb about last 40 years,8301
9875,0,members of u2 to stare in different directions,6026
2483,1,"woman going to take quick break after filling out name, address on tax forms",1942
6864,1,"local man knows he moved to minneapolis for something, but can't remember what",4331
10315,0,assistant uses cake to smuggle cake-decorating set to martha stewart,12073
1677,2,u.s. falls short of success,8775
13373,1,mom just called to say hi and that she's very sad,7972
6304,0,"sleeping airline passenger misses out on aisle-wide bacchanalia of peanuts, decaf coffee",10562
5454,2,yemen unveils new 80-story drone zapper,10215
5236,1,dog costumed to create illusion of sports-team preference,10124
3997,0,santa claus killed in electric-razor crash,2775
6574,2,mike pence struggling to reckon with vision of prophet muhammad revealing that vp destined to become next president,4145
3737,2,republicans give in right before obamacare would have been repealed,2617
3340,1,area woman didn't say that; you said that,2411
897,1,study finds blame now fastest human reflex,1094
9952,1,nation spooked after running into creepy old night watchman,6065
1759,2,nostalgic hope hicks barely recognizes young woman on white house id badge,1546
7312,0,fleshlighthouse guides weary sailors home to realistic vaginal texture,4589
9892,0,aerobics show used for almost completely non-aerobic purpose,6034
11557,1,loveless marriage offset by beautiful four-bedroom home,6953
4673,1,new hobby to tide retired man over until death,3135
6024,2,senator misses simpler time when he could do abominable things in peace,3856
11590,0,compassionate fisherman doesn't have heart to throw trout back into incredibly polluted lake,12570
10628,1,"bodybuilder strong, but now what?",6419
5928,1,area man overly proud of never wearing underwear,3805
6669,0,"rice krispie treat eaten in 8"" x 8"" square",10705
12404,1,bodybuilder's veins now outside of his skin,7431
11269,2,mitt romney soars in polls after leaving country,6774
10064,2,report: u.s. leads world in lost sunglasses,11977
2782,1,guys' weekend getaway begins with daring purchase of new kind of beer,464
1203,2,trump boys announce they will not hesitate to egg russia if provoked,1257
3069,0,sesame street mourns death of original letter k,2259
9169,2,"tearful trump puts down ladle, walks out of soup kitchen after learning charitable foundation shutting down",5630
13263,0,sla murder trial nostalgic trip back to more innocent time,13210
10247,2,"paul ryan mentally logs 4,613th missed opportunity to put stop to all of this",6231
12318,2,john kerry poses as masseuse to get few minutes with putin,7382
8236,1,refugees grateful for chance to see europe while being bounced from country to country,11264
1217,1,mother proud she raised type of person no one would ever believe would rape someone,1262
12014,2,ryan handed romney's latest political positions before walking on stage,7212
694,0,serial killer annoyed by young murderers with no appreciation for albert fish,975
4281,1,helicopter ride pretty much delivers the goods,9767
9587,1,couple excited to start planning wedding expenses,5866
10931,0,gun used to kill man in city,6582
3307,2,"report: only 893,000 news stories to go until 2016 election over",2387
13415,2,obama caught trying to jump white house fence,13264
8063,0,scientists finally pronounce human genome,5021
11882,2,trump boys defend sending saudi arabia plans for cool missile on personal etch a sketch,7129
8590,2,"unusually level-headed, charismatic lichen species named after obama",11398
6075,2,joe biden shows up to inauguration with ponytail,3882
9935,0,prima donna surgeon storms out of half-full operating theater,6055
11075,0,modern-day caligula orders everything bagel,12389
4175,1,report: one in three americans will get dessert if someone else does,9718
6062,0,teary-eyed wrestlers bid farewell to friends made at summerslam,3875
4018,2,william barr shows up to congress to testify at 3 a.m. after reading email wrong,2789
2351,0,dr. scholl's introduces new freeze-away toe remover,1857
9692,2,nation still reeling from mega-success of 'mr. popper's penguins',11826
6500,1,local audience deemed 'great',4108
8415,0,new domino's app allows customer to track pizza's movement through digestive system,5213
418,0,aliens mourn as final cheers episode reaches alpha centauri,8281
4908,0,casual christian accepts christ as his lord but not his savior,3255
12210,1,area teen receives $2 from grandma,7323
3860,2,jeb bush warns rnc attendees of bad cialis going around parking lot,2690
12328,1,stupid man overshadowed by louder stupid man,7389
7374,0,friend asks if there any openings at job he constantly mocks,4627
13121,1,apartment completely flooded with disgusting sunlight,13152
1319,2,exxonmobil swears it's going to start taxes early this year,1319
5687,0,"department of interior sets aside 50,000 acres as national wildfire refuge",10307
8964,0,mta reveals they have no idea where voices speaking to everyone on subway coming from,13470
8317,2,romney appeals to hispanic voters for return of watch he left on dresser,5162
4633,0,computer scientists say ai's underdeveloped ethics have yet to move beyond libertarian phase,9904
3416,1,baby feels foolish after realizing stranger waving at toddler next seat over,9438
971,1,doritos good,1135
7211,1,report: average american has just 20% of what it takes,4529
5362,1,mom guesses dressbarn closure means she'll just have to go shop with all the sluts over at chico's now,3505
7589,2,trump teeters on white house ledge weighing pros and cons of killing self right now to distract from mccain's funeral,4749
11801,1,"trip to bar gives friends opportunity to sit around, do nothing in different place",7086
2419,0,"sxsw as cool and as real as it gets, reports marketing associate",9055
7919,1,mom thought nfl's first openly gay player should have been drafted earlier,13452
10447,0,dog keeps iceland awake all night,6336
4791,1,only jewish kid in class asked to talk about holocaust remembrance day,9966
11610,1,going out to dinner with food-loving friend a huge ordeal,6982
9119,1,amazing original thing to become hated cliché in 6 months,11611
3545,2,mlk's family urges nation to spend anniversary of his death twisting his words to fit own political agendas,2505
4245,2,white house press secretary responds to question about rising obamacare premiums with torrent of toxic spray from parotid glands,2904
4892,0,priest regrets vow of celibacy after learning about furries,570
1580,0,burger king introduces new healthy deep-steamed french fries,1448
5172,2,"trump: 'we will fight in afghanistan until victorious, or i change my mind, get distracted, look bad, or get bored'",3414
7519,2,"'there's nothing to it,' secret service agent assures mar-a-lago bellhop assigned rooftop sniper duty",10999
7103,0,"cat looking out window, bird form unbelievably intense fifth-of-a-second bond",10854
11372,1,lazy man waiting for spark of inspiration to finally get started on masturbating,6837
4845,0,new pepsi negative-220 burns twice the calories it contains,3226
13481,2,magnanimous banker hires occupy wall street protesters,13284
6958,0,plant dead because of you,4383
13154,1,employees on other end of conference call just want it to be over,7845
5433,0,rotting smell in congress traced to decaying senator who died inside wall,3539
3988,0,mar-a-lago assistant manager wondering if anyone coming to collect nuclear briefcase from lost and found,9646
10649,2,report: media coverage of bear attacks may be biased,12216
4093,2,pete buttigieg stuns campaign crowd by speaking to manufacturing robots in fluent binary,2827
9428,1,"yeah, area man is drunk... so?",5780
8018,2,roy moore retires from politics to spend more quality time with someone's kid,4996
1361,1,only two segways in town collide,1338
4925,1,"'he's a stockbroker,' says woman who finds that exciting",3262
13213,1,woman constantly treating herself for once,7876
4485,2,new york times 'faces of the dead' editor just needs a couple more to fill out corner,9845
11375,1,report: most parents willing to entrust children to anyone in character costume,6838
9366,0,non-denominational terrorist organization welcomes extremists of all faiths,5741
90,1,woman who's been on the pill for years thinking about switching to new set of debilitating side effects,650
9900,1,captain's hat really completes street lunatic's ensemble,6039
3067,2,libertarian candidate worried after latest poll shows him 98 points behind,2258
8737,2,clinton's sight restored,5395
9904,1,movie fails to deliver stupidity promised in preview,11912
11795,2,frustrated rick santorum still waiting for go-ahead from god to suspend presidential campaign,7082
8342,1,unfinished basement has weird feeling about way woman looking at it,11304
5401,2,hillary clinton hints at presidential ambitions by concealing information from american people,3521
5572,1,brave woman enters restaurant without first looking it up online,10260
7126,2,dzhokhar tsarnaev rushes out of summer class to make court hearing,4478
9228,1,"dad's tough exterior hides angry, resentful center",5660
5302,1,"area man could have sworn randy newman sang welcome back, kotter theme",67
12144,0,honda civic refusing to start engine in solidarity with striking uber workers,12777
7020,0,fda recalls food,10820
12706,0,new iphone application tracks progress of deceased loved ones' decomposition,7609
1208,0,god loses pouch filled with crystals that give him powers,1258
7208,0,ponds institute tops 1997 cosmopolitan college poll,10895
9138,1,butterfly under immense pressure not to fuck up timeline with misplaced wing flap,11619
720,2,cat totally unaware its owner aaron eckhart,991
5361,1,coworkers currently gchatting about you,3504
492,0,boss born in 1991,8305
591,2,giddy tim kaine presses face against campaign bus window as horse trailer drives by,919
5240,2,clinton says badtz-maru may be his favorite sanrio character,165
2218,0,enjoyment of steve miller band's 'jungle love' last piece of common ground in america,8990
9229,1,grandmother's folksy sayings delay senility detection for years,11652
7317,2,john bolton insists iran likely harboring dangerous terrorist osama bin laden,4594
7680,0,surinamese man struggling to write the great surinamese novel,11061
4139,1,man who actually needs grey poupon unable to bring self to ask,2850
4683,1,report: fiber optics not a real thing,9926
9057,2,paris vows to rebuild notre dame despite cosmic absurdity of seeking inherent meaning in fleeting creations of man,13603
7737,2,police repeatedly shoot tim cook after mistaking iphone for gun,11082
7086,2,trump confident u.s. military strike on syria wiped out russian scandal,4460
5372,0,nasa: voyager-1 has officially carried remains of joan crawford outside solar system,10182
11003,1,man wouldn't have worn costume to work if he'd known he was getting laid off,6623
8687,2,tiny ben carson tugs at debate moderator's pant leg,11439
970,2,"'game of thrones' audience disappointed by season finale's bland, uninspired incest",8490
3933,2,tonight's dnc program to be just 3 hours of osama bin laden's blown-off face projected onto screen,2735
9240,0,ad for drummer personally attacks old drummer,5669
8008,2,"huckabee decries obamacare's failure to help slow, cross-eyed cousin who got kicked by mule",4988
10773,0,ozzy osbourne bites head off five-pound chocolate rabbit,12265
3294,2,bradley cooper racks up staggering one oscar nominations,2378
3501,0,lesbian hen enjoying hen house,9478
6614,2,romney privately wondering how in the name of fuck he's going to appeal to asian voters,4172
13570,2,terry jones - could have at least manned up and burned one koran,8092
7265,1,partygoer rolls a couple of fat burritos to pass around,10912
2762,1,dysfunctional family brought together by liquor,2103
5855,2,craig kilborn weds self in private ceremony,3759
6488,2,hillary launches campaign to raise $100 million or else she'll run for president,10639
2315,2,mark zuckerberg cited for contempt of congress after refusing to shut the fuck up about how he started company in dorm room,1837
10471,1,"'it's a privilege to have worked with such talented people,' says coworker getting the fuck out of there",12140
8410,0,"'depot buys max,' nation's office-supply-loving teens text frantically to one another",11333
9316,2,white house honors aretha franklin by not releasing official statement on her death,5710
1738,2,kanye west jumps on massage table to deliver speech about relaxation,8799
7161,0,hero firefighter: 'i'm a hero',4500
895,2,bush surges ahead in polls after strong showing on pommel horse,1093
2574,1,real life magic school bus flies through human body,9118
11181,1,family wishes dad could find healthier way to express emotions than bursting into full-blown musical number,6718
4364,0,social media startup looking for smug little fuck to take leadership role,9800
2152,0,cdc rolls out fleet of narcan biplanes to fumigate opioid-ravaged small towns,8960
12886,2,travel channel blows its 'bed and breakfasts of new england' wad,160
903,1,employee worries coworker's computer screen may be larger,203
10746,1,area woman prefers to get same advice from as many people as possible,6483
6176,2,"firewood, bread top new russian agenda",3940
7911,1,man who just beat computer solitaire never asked for overwhelming sensory assault of victory animation,4933
12772,1,on-line gambling too depressing to even think about,7647
1157,1,instant gratification sped up,1230
4504,0,entire nation pitches in to save yosemite,3046
