,headline
0,thirtysomething scientists unveil doomsday clock of hair loss
2,mother comes pretty close to using word 'streaming' correctly
3,richard branson's global-warming donation nearly as much as cost of failed balloon trips
4,shadow government getting too large to meet in marriott conference room b
5,ford develops new suv that runs purely on gasoline
6,area boy enters jumping-and-touching-tops-of-doorways phase
7,area man does most of his traveling by gurney
8,guard in video game under strict orders to repeatedly pace same stretch of hallway
9,secret service agent not so secret about being david alan grier fan
10,leading probability researchers confounded by three coworkers wearing same shirt color on same day
12,"expansive obama state of the union speech to touch on patent law, entomology, the films of robert altman"
13,naacp demands less minority representation on upn
14,new history textbook makes hatred of history come alive for students
15,report: bridge probably has whole mess of bats under there
16,god getting strong urge to bring back dinosaurs
17,"handshake comes in at unusually high angle, velocity"
18,mom keeps sending newspaper clippings about former classmates who have been murdered
19,report: make it stop
20,coed rec softball team having trouble finding enough hyper-competitive men to ruin experience
21,brutalist beaver constructs paul rudolph-inspired dam
22,suicide bombing: can parents spot the warning signs?
23,state department warns americans traveling abroad to avoid lame amsterdam windmill tour
24,families of missing flight passengers just hoping media gets closure it needs
25,fender releases new hybrid gas-electric guitar
26,romney volunteers going door-to-door to let obama supporters know president's dead
27,hollywood's biggest stars endure long lines at oscars security screening
28,longtime reader of lib-slaves.info sick of mainstream bias on sites like wideawakepatriot.com
29,beijing fire department extinguishes massive five-alarm burning cloud of smog
30,"'active shooter at large,' reports endless background hum of modern american life"
31,historical archives: amazing publick spectacle!
32,israel passes law cementing itself as exclusive nation-state of benjamin netanyahu
33,onion social cracks down on sexual harassment by banning all women from platform
34,drunk driver in the zone
35,egyptian woman wishes screaming protester husband would go bonkers for her once in a while
36,report: majority of instances of people getting lives back on track occur immediately after visit to buffalo wild wings
37,groundbreaking study finds gratification can be deliberately postponed
38,report: 70% of trump endorsements made after staring at bedroom ceiling for 4 hours
39,produce section bursts into laughter after will ferrell makes casual remark about apples
40,dad immediately hands phone to mom
41,local man's fear of snakes increases with each snakebite
42,vespa corporation enchants another slight little man-child
43,standards lowered for second search through fridge
44,man in international airport only speaks business
45,area mother enters 16th year of post-partum depression
46,historians suggest 'goodfellas' youtube clips may be fragments of larger work
47,department of agriculture locates perfect goat
48,cocksucker beats up motherfucker
49,wheelchair-bound student would have preferred to sit out pep rally
50,nation checks out cnn.com to see what their old pals the tsarnaevs and castros are up to
51,47-second clip from 'family ties' season 3 now available on youtube
52,mom announces plans to get out some of your old baby stuff and quietly stare at it
53,members of opening band walking among crowd during intermission like gods among men
54,shy friend experimenting with personality
55,jay inslee smashes through wall of town hall in solar-powered mech suit to announce climate change plan
56,"parents' password a grotesque combination of children's names, birthdays"
57,christian weightlifter bends iron bar to show power of god's love
58,stomach sets aside synthetic additives until it has a few minutes to figure out how to digest them
59,trump regrets choosing kavanaugh after supreme court nominee keeps talking about how much he respects women
60,south dakota asked to water north dakota's crops over the weekend
61,exasperated huckabee sanders reminds press corps that children under 14 can't feel pain
62,non-priest arrested on charges of child molestation
63,obama finally tells rambling tom vilsack to shut the fuck up during cabinet meeting
64,nation inspired by bravery of teen just wearing bikini right into mcdonald's
65,arizona iced tea unveils new 4-foot-tall cans
66,tom bosley named secretary of naps
67,party not big enough to move out of kitchen yet
68,minotaur wondering if there more to life than bashing in heads of those who dare wander into labyrinth
69,"shaven, cologned grandpa heads into town to rake in d-day pussy"
70,san diego zoo acquires chinese man
71,congress votes to intervene in local wedding
72,hero soldier receives presidential thumbs-up award
73,annoyed movers weren't expecting client to have belongings
74,argentina tightens security in anticipation of numerous criminals arriving for g20
75,senior citizen shaken by diminished bawdy-limerick recall
76,man filled with gratitude at sight of other customer in nice restaurant wearing jeans
77,'stranger things 2' creators say keen viewers will notice twinge of disappointment hidden in every scene
78,huckabee sanders tells colleagues she's taking temporary post as google ceo before transitioning into full-time role as sultan of brunei
81,bisexual's parents half-understand
83,"brilliant, innovative ceo just wrote words 'social media' on whiteboard and underlined it"
84,new anti-drug program teaches teens to resist psychiatrist's constant pressure to use drugs
85,there no way tv character could actually afford big 'new york city' coffee mug
86,area man feels even lazier when he thinks about how much isis has accomplished this year
88,buzzfeed editors unsure how to spin petraeus story into reason the '90s were great
89,marine corps shortens slogan to 'the few'
90,woman who's been on the pill for years thinking about switching to new set of debilitating side effects
91,man forced to pathetically comb through movie for familiar scene after falling asleep previous night
92,congressman lets his guitar do the talking
93,michele bachmann thankful no americans died in sikh shooting
94,complete idiot forgot to shave area between mouth and nose
95,mom learns about new vegetable
96,troop gradually withdraws
97,fire department deploys unmarked trucks
98,ted danson totally nails tonight show interview
99,70-year-old woman decides it time to start dressing entirely in purple
100,woman in commercial doing yoga to narration of drug's fatal side effects
101,zoo posting hourly updates on aphid about to give birth
102,dave matthews band apologizes after tour bus dumps another 800 pounds of human shit onto same boat full of people
103,realistic day planner only includes first couple weeks after purchase
104,palm tree fires off warning coconut
105,couple dressed as mario and luigi drunkenly making out on couch
106,struggling media company almost desperate enough to hire someone qualified for job
108,census finds enough homeless people living in public library to warrant congressional district
109,"report: 1 in 5 air ducts contains person looking, listening in on you"
110,hillary clinton suspended 3 weeks by fec for spitting on volunteer
111,officials warn consumers of counterfeit tickets ahead of solar eclipse
112,fbi shuts down prominent new isis recruitment website
113,area facebook user incredibly stupid
114,strapping young man to address congress
115,"area man too busy for his buddy phil, eh?"
116,report: 50% of heaven's population just assholes who begged for forgiveness at last second
117,'elle' magazine accidentally airbrushes naomi watts out of cover altogether
118,international space station tented to spray for xenomorphs
119,passengers praying uber just a hobby for elderly driver
121,terrified fda warns something making bananas black after several days
122,teddy bear feels terrible for sparking 'what are we?' conversation
123,man flirting with girl at party can't wait to be informed she has boyfriend
124,mysterious man in parking lot threatens to harm rudy giuliani if he ever blabs about trump's legal payments again
125,obama under fire for playing t-ball during vietnam
126,study: good porn still hard to find
127,lester holt begins debate by reiterating he doesn't know who these fucking people are
128,homosexual dolphin has highly developed sense of gay-nar
129,report: mom sending you something
130,600-pound butter cow sculpture wins iowa caucus
131,"area juggler juggles family, juggling"
133,desperate gop spotted in south dakota trying to build keystone pipeline themselves
134,woman comforting friend just going to throw compliments against wall and see what sticks
135,u.s. mint introduces new double-stuf quarters
138,paramedics didn't realize how hard it would be to cut drunk woman out of elmo costume
139,rnc taps dennis hastert to lead new youth outreach program
140,money spent for old time's sake
141,anderson cooper throws another box of letters from gay children into dumpster
142,toddler unsettled by whatever possessed her to bite friend's face
143,kurt warner cheered on by wire-haired man-goblin
144,man runs into ex-wife while wearing sandwich board
145,does strange death curse haunt cast of gone with the wind?
146,hillary clinton relaxing before debate with few hours of debate practice
147,earth ranked number one party planet
148,new ad preys on people with 'ideas'
149,mom uses full name to refer to bisquick impossibly easy cheeseburger pie
151,"public outraged as price of fast-depleting, non-renewable resource skyrockets"
152,new downloadable content for 'assassin's creed syndicate' factored into monthly living expenses
153,largemouth bass has largemouth sass!
154,"pope john paul ii, longtime owner of popemobile, dead at 84"
155,global-warming crisis makes for delightful mid-february afternoon
156,"grandchild, grandfather equally dreading collaboration for school interview project"
157,bartender hurt by unfinished drink
158,signs make upcoming section of road sound pretty badass
159,"audio experts confirm whiny, irritating noises in secret recording devin nunes"
160,uneventful past finally catches up to boring man
161,"sources: c'mon, just give us the goddamn pulitzer already"
162,if area dad steps on legos one more time
163,boss came to work today dressed as guy who fires sean
164,"dirty, bearded vince foster bursts through doors of clinton fundraiser"
165,surrendering trump boys solemnly salute each other before leaping from white house first-story window
166,report: 55% of nation's granite now engraved with names of victims
167,hollywood announces plan to remake jimmy stewart
168,mother ferries 4 more shirt options back to son in gap dressing room
169,negative review of 'a wrinkle in time' peppered with critic assuring readers he still totally supports diversity
170,kanye west: 'i would've ridden away from a slave plantation on a motorcycle first chance i got'
171,clinton assures tim kaine she'll continue serving as president in event of her death
172,rugged new sport-utility vehicle takes on mall parking lot
173,report: new 'the handmaid's tale' season focuses on dangers of feminism run amok
174,olympics officials clearly trying to buy more time with 6-day-long opening ceremony performance
175,first-grader reeks of urine
176,u.s. fish and wildlife officials release photos of missing perch
177,hope in students' eyes too much for screenwriting teacher to handle this week
178,disastrous ad campaign appeals to basic human intelligence
179,cozy little out-of-the-way place opens 12th location
180,starring in hollywood blockbusters los angeles man's only claim to fame
181,trump sits down beside fire with quill and ink for evening writing out tweets
182,entire treasury department competing for same goldman sachs job opening
183,penny not so lucky for tortured soul of lincoln trapped inside
184,substitute teacher can tell he's filling in for real asshole
185,wedding experts say engagement ring should cost at least three diamond miners' lives
186,new study finds humans may have some capacity for compassion
187,congress confused by $500 million in trump's budget allocated for 'laser stuff'
188,area throat-clearer to go see movie
189,mike pence training for vice presidential debate by hitting punching bag with climate change study taped on front
190,wendy's new homestyle chicken strips salad shamelessly touted
191,modest isis leader credits promotion entirely to drone strikes
193,experts caution new car loses 90% of value as soon as you drive it off cliff
194,report: north korea just enjoys nuclear talks
195,goldfish teetering on edge of sanity
197,"dad recounts amazing story of how, through quick thinking, he saved $4.27"
198,boy scouts celebrate proud history of preparing teens for not having cool friends
199,hypochondriac maple tree always convinced it has asian longhorn beetles
200,local welder suffering from welder's block
201,wedding album off to bizarre start with photo of 2 acorns floating in glass of water
202,plan to live in storage facility voiced
203,report: getting massages at airports apparently part of certain people's lives
204,rival dojo in for big surprise at regionals
205,postal service: 'and wait until you cocksuckers see what we do with wednesdays'
206,that's what host of 'showtime at the apollo' talking about
207,woman starting to worry she just has type of face where makeup looks insane
208,two hipsters angrily call each other 'hipster'
209,new law to forgive student debt for college graduates once all their dreams shattered
210,man angry at self after not recognizing actress in eyelash commercial
211,"court summons comes with 1,025 free hours of aol"
212,prizes on price is right looking better as man ages
213,toys 'r' us sign triggers pavlovian shrieking response in child
215,savion glover taps his way out of another speeding ticket
216,woman under impression she being discreet about fishing stray hair out of bra
217,entire napoleon dynamite plot pieced together through friends' quotes
218,area dad stares longingly at covered grill in backyard
219,"well, neighbors just got a pit bull"
220,consumer confidence verging on cockiness
221,jimmy fallon six tantalizing months from disappearing forever
222,boss' dick not going to suck itself
223,america's love affair with ally mcbeal ends violently
225,man pledges loyalty to brand in quiet convenience store ceremony
226,archaeologists: egyptian pyramids actually early attempt at camping
227,last month apparently women's history month
228,innovative fat man combines waffles with ice cream
229,local building too wheelchair-friendly
230,new after-school program aims to keep children off streets for additional 45 minutes
231,concerned nra official rushes out to purchase congressman following mass shooting
232,defiant evangelicals branch off into new 'first molestist' sub-denomination
233,insect with limitless flying space rockets straight for man's pupil
234,magazine runs article about louis c.k.
235,george r. r. martin kills off whole family
237,7-year-old asshole demands you king him
238,local oafs to spawn
239,warrantless surveillance bill to protect nation by creating dozens of future whistleblowers
240,report: it unclear whether opposition from every sector of american society will have any effect on healthcare bill passing
241,chinese citizens observe 25-year moment of silence for tiananmen square massacre
242,bausch & lomb introduces line of aviator contacts
243,cameron diaz finally opens up about generally positive experience in show business
244,report: average american consuming 4 ounces of cheese right now
245,eager understudy beginning to think john lithgow impervious to disease
246,martin shkreli faces rough stay in prison system where inmates who funded hair theft are lowest caste
247,historical archives: to be sold - two chamber pot house
248,caterpillar in pupal stage for past 3 months going to be pissed if it turns out to be moth
249,archaeologists discover cave where ancient humans first had to pretend to like friend's art
250,"fed: 'if jobs are meant to be with us, they'll come back on their own'"
251,man races against time to take out trash bag with widening puncture
252,"vicious, man-eating carnivores on decline in arctic"
253,wildebeest taking awful lot of credit for stampede
254,senatorial candidate challenges opponent to drop out of race
255,expectant parents throw some values together at last minute
256,governor too embarrassed to say which state he leads
257,report: jessica milly has put out
258,'missed connection' ad obviously cheney
259,food network production assistants prep guy fieri with dry rub
260,"man completes life $130,000 over budget"
261,masturbating mom can't get bobby flay southwestern eggs demo to stop buffering
262,bruno mars takes home coveted 'least threatening artist' award at 2018 grammys
263,inconsolable sarah palin opens up about sacha baron cohen betrayal to cardboard cutout of whoopi goldberg
264,chinese newlyweds wondering what they're going to do with all this medicinal bear bile
265,"study finds only 1 in 3 lasik surgeries end in laser boring through eye, incinerating brain, shooting through skull on other side"
266,nissin introduces extra-large drum noodles
267,ganymede totalled in three-moon pileup
268,"'the time to act is now,' says yellowing climate change report sitting in university archive"
269,man who plays devil's advocate really just wants to be asshole
270,starbucks offering new lukewarm coffee to help ease customers' transition from iced to hot
271,cactus scientists recommend drinking 8 cups of water per year
272,7-year-old puts on uno face
273,harrison ford begs agents to just let him die now
274,bush to london bombers: 'bring it on'
275,new study recommends insects spend at least 30 minutes skittering per day
276,funeral attendees getting misty-eyed during first dance with corpse
277,rolos unveils new cryptocurrency exclusively for rolos customers
278,"'your father died peacefully in his sleep,' assures hospice nurse who spent past 6 months watching man wither away in agony"
279,new study reveals nothing pfizer's lawyers can't take care of
280,blender left on to keep cat company
281,coworker wondering if anyone interested in laying bare their physical shortcomings in basketball league this year
282,"new instant lottery game features three ways to win, 19,839,947 ways to lose"
283,architects of 2026 market crash just finished a highly productive lunch
284,equifax impressed by hackers' ability to ruin people's finances more efficiently than company can
286,bush introduces new timmy blanchard left behind act
287,candidate with no chance of winning nomination settles on goal of crushing hickenlooper campaign
288,grandma hangs on to spend one last christmas with nursing home staff
289,pallbearers carry leslie nielsen's coffin without incident
290,angry lumberjack demands hearty breakfast
291,biden urges paul ryan to check out nude scene from 'porky's' on phone
292,ice argues migrants in camps are free to die at any time
293,area woman's safety net braces for another impact
294,area bar used to be cool; now lame
295,"jury finds man guilty of murdering wife and children, but gets it"
296,local man a paper-towel black hole
297,"new monster energy defibrillator touts 1,200 volts delivered straight to heart"
298,genetics emphatically deny playing any part in area man's body
299,accidentally closing browser window with 23 tabs open presents rare chance at new life
300,man thinks people care enough about him to be let down by his failures
301,newly tenured professor now inspired to work harder than ever
303,report: no one at white castle wants to make friends
304,publicist schmoozes wife into sex
305,churchgoing widows: what gets them hot?
306,skywriter leaves suicide note
307,man crushed by lack of filth on q-tip pulled from ear
308,iowa resident has opinion month too late
309,anonymous source: 'i'm a cowardly snitch'
310,gorgeous 25-year-old dead at 79
311,"report: u.s. consumers spend $900 billion each year after saying 'gimme one of those, too'"
312,"putin condemns ukrainian people's unprovoked 1,000-year occupation of south russia"
313,"son discovers dad's welcome back, kotter spec script while cleaning out attic"
314,"mtv promotes, airs, condemns controversial new video"
315,10-year-old first responders rush to bike crash scene to check out tyler's fucked-up leg
316,laptop really getting off from having both usb ports stuffed
317,hidden valley ranch bombed by balsamic extremists
318,chuck grassley scratches 'christine blasey's a slut' into senate bathroom stall
319,raid on nacho-supremacist compound uncovers guacamole-making materials
320,otherwise savvy woman duped by mascara makers again
321,suspect cleans up real nice
322,guy in suit handling newspaper like a pro
323,mythbusters team struck down by zeus
324,85 percent of u.s. cole slaw remains uneaten
325,grocery-store freezer's white castle section a wreck
326,putting up with dave's shit not in job description
327,nation doesn't know if it can take another bullshit speech about healing
328,woman who had almost formed healthy sense of self rejoins social media
329,head on pike really pulling together castle's look
330,area dad saw a great show on bigfoot last night
331,mom starting to fear son's web series closest thing she will have to grandchild
332,vladimir putin begins second term as whatever he is
333,"12 publicists dead, 43 injured in struggle to transform the rock into dwayne johnson"
334,report: employers know within first 5 minutes of job interview whether they will murder applicant
335,"defense needs to be more physical, reports man slumped on couch for past 5 hours"
336,report: watching episode of 'downton abbey' counts as reading book
337,grandma excited to show off new beach sweater
338,"now that man has heard about barack obama, he sees references to him all over the place"
339,fat girl euphemized
340,death withdraws icy hand from shoulder of caroline kennedy
341,report: many jobs lack benefits to cut
342,burger king introduces new thing to throw in front of kids after another hellish day at work
343,man not even the hot kind
344,millions across country celebrate 'make a kid at work' day
345,man's area code provides exciting glimpse at past life
347,wayne lapierre goes on harpooning spree to prove some sort of point
348,single woman would love to hear them call her lonely now that she has basil plant
350,man discovers huge cache of rare fossils while walking through natural history museum
351,new report finds fastest-rising cause of death in u.s. is losing chess match to grim reaper
352,group cheers after group hears group's name called
353,town hall audience gives amy klobuchar standing ovation as she lifts chris cuomo up by throat
354,nation's moms demand christmas list
355,trump mocks christine blasey ford for forgetting basic facts about a woman's place
356,negative parent-teacher conference not exactly eye-opening for area mother
357,semiotics department accuses university administration of anti-semiotism
358,area man has own version of neighborhood-watch program
359,facebook: 'identifying hate speech is difficult because some posts actually make pretty interesting points'
360,college roommates to continue bonding process until real friends made
361,new study finds average american stands no chance against what's coming
362,hang-glider gang terrorizes elderly hot-air-ballooning couple
363,brett kavanaugh reiterates cruel and unusual punishment what makes someone a true kappa
364,local woman considers telling gynecologist whole truth
365,"watching thousands march in his honor unlocks deeper, darker corner of trump's psyche"
366,google's 9/11 homepage design stirs controversy
367,man with apple hovering in front of face sues rené magritte's estate
368,man frantically returns to website that just crashed his browser
369,frustrated fcc unable to stop use of word 'friggin''
370,enraged character in stageplay to be unconvincingly restrained by other actors
371,nation mostly alarmed that government's top programs handled by 29-year-olds
372,trump flubs gaffe
373,voter just needs to know which candidate chops wood in a flannel shirt
374,'decision 2000' actually made in smoke-filled room in 1997
375,"diabetic, gout-ridden kim jong-un by far healthiest person in north korea"
376,triumph of human engineering slept through
377,asshole from plane greeted at baggage claim by whole family
378,"authorities swiftly announce 1,600 washington dairy cows found mutilated, arranged in pentagram killed by blizzard"
379,fucking idiot has perfect gif for that
380,climate researchers warn only hope for humanity now lies in possibility they making all of this up
381,notorious b.i.g. cremation enters fifth week
382,enthusiasm of 18-year-old first-time voter completely unbearable
383,orlando locals fear town starting to become overrun by tourists
384,fda confirms psilocybin reduces risk of mindlessly following society's rules like fucking lemming
385,life unfair
387,stick shift bragged about
388,"unemployed prince harry, meghan markle announce plans to give baby up for adoption"
389,guy looking to feel horrible about aspect of everyday life decides to watch documentary
391,"report: buddy dysmorphia sufferers experience skewed, negative perception of shape of friends"
393,parents considering second child so daughter can have someone to grow apart from
394,wise oracle proclaims to all at barbecue that he felt a raindrop
395,chipotle mayo doing all the heavy lifting in sandwich
396,nobel prize in chemistry awarded to taft middle school teacher mr. ambler
