,headline
10290,wilbur ross shakes self awake after briefly dying during cabinet meeting
10291,'roseanne' spinoff showrunner hopes big puddle of blood in kitchen enough to explain main character's disappearance
10292,high school breathes sigh of relief as difficult teacher ages out of education system
10293,delirious koala hasn't slept for 72 straight minutes
10294,giuliani says kim jong-un begged like a has-been-politician-turned-hack-attorney trying to get a job at the white house
10295,paranoid chinese government erases all evidence of country's existence from internet
10296,exxonmobil ceo depressed after realizing earth could end before they finish extracting all the oil
10297,aides gently tell trump he can't bring all his gold lion statues on airplane
10298,winning argument with aging parents less satisfying than it once was
10299,dinner party conducting full-scale investigation to determine if tip was included
10300,sonny bono foundation prevents at-risk youths from skiing into trees
10301,nasa announces plans to place giant pair of shades on sun
10302,"$80,000 wedding beautiful"
10303,evolutionary biologist discovers common human ancestor at cousin's wedding
10304,news anchor wonders where all these great stories come from
10305,frito-lay contest offers consumers chance to appear in upcoming bag of sunchips
10306,new homeowner suddenly fascinated by molding
10308,nature films: do they glamorize molting?
10309,michael jordan accidentally packaged in plastic
10310,trump deploys national guard to press conference for standing ovation
10311,report finds more americans putting off children until companies are ready
10312,frugal couple saves money by making own porn
10313,saddam enrages bush with full compliance
10314,apartment listing sweetens the pot with offer to sell current tenant's 9-year-old furniture
10315,assistant uses cake to smuggle cake-decorating set to martha stewart
10316,"man craving some kind of human connection that would let him know he's not alone in this world, sliders"
10317,2012 marvel handbook casually reveals peter parker uncircumcised
10318,report: economy must be doing pretty well if entire season of 'bones' online for free
10319,report: rich suitors able to correctly guess beautiful woman's dress size 92% of time
10320,"4-year-old's idea of barbie, ken marriage involves lots of head collisions"
10321,podiatrist a jerk
10322,statue of liberty corporation to shut down all but new york flagship statue
10323,newly deployed soldier has dreamed of fighting in afghan war since he was little kid
10324,entertainment weekly wins excellence-in-caption-pun award
10325,stripper failing school she's working self through
10327,nation clinging desperately to brief inspirational moment before being thrust back into raging election maelstrom
10328,man running toward departing train must have finally realized he loves her
10329,food purchased as souvenir tragically revealed to be available back home
10330,china vows to begin aggressively falsifying air pollution numbers
10331,republicans outraged over redtube censoring of conservative voices
10332,bush dies peacefully in his sleep
10334,new hampshire legislature passes bill naming fentanyl state opiate
10335,two-faced house guest who didn't need anything suddenly wants glass of water
10336,study: 90% of bike accidents preventable by buying car like a normal person
10337,oscar countdown 2002 begins
10338,'game of thrones' season 3 opens with every character getting fingered while discussing arrival of winter
10339,comic book fans adamant that human torch be played by actor whose body actually engulfed in flames
10340,embarrassed george lucas still just telling new wife he works in digital media
10341,lifeguard hoping to make up for last summer
10342,abc camera immediately cuts away after showing harvey weinstein sitting at oscars
10343,city councilman from future warns against building 12th avenue rec center
10344,detroit tourism board's 'hidden detroit' campaign results in 24 deaths
10345,man always three ingredients away from making pancakes
10346,homesick trump stays up all night on phone with automated mar-a-lago reservations line
10347,world unites in desire to have a little more time between terrorist attacks
10348,dripping wet 7-year-old gets on hotel elevator
10349,hungover energy secretary wakes up next to solar panel
10350,macarthur genius grant goes right up recipient's nose
10351,caller enters remote backwaters of 1-800 automated messaging system
10352,sleazy health insurance covers any doctor's visit they can watch
10353,"trump lawyers anxious 4,731st shoe will drop"
10354,man's anxiety not about to let depression muscle in on turf
10355,2-hour meeting spent thinking up hashtag absolutely nobody on planet earth will ever use
10356,pro-life demonstrator clearly using image of subway chicken enchilada melt on anti-abortion poster
10357,"jim morrison foundation awards $50,000 grant to little shit who thinks he's a poet"
10358,homeland security criticized for allowing known killer to stay in country
10359,everyone on campus afraid of that one bar
10360,mitch mcconnell feeling emasculated by wife who makes more illicit money than him
10361,painting of jesus totally knows area man is high
10362,eating entire box of donuts not originally part of evening's plan
10363,needle-exchange program attracting 'druggies'
10364,jefferson starship memorial reopens on national mall
10365,air wick introduces new piss-scented bathroom diffuser
10366,restaurant patrons rapidly losing faith parents going to do something about 4-year-old
10367,rain told to go away in 1986 returns
10368,kavanaugh sobering up after 35-year bender shocked to find out he's supreme court nominee
10369,thousands of onion social users burn effigies of ceo in massive show of support for company
10370,"bill cosby attacks disrespectful behavior, skyrocketing crime rate among elderly black male comedians"
10371,couple forgets 70th wedding anniversary
10372,rockin' party dude strongly recommends additional drinking
10373,heroic pickles holding lid shut from inside
10374,rising star john kerry's stirring speech paves way for 2016 presidential run
10375,elite congressman trained to kill legislation in 24 different ways
10376,study finds not acting like total fucking moron most attractive quality in potential mate
10377,ironic-kitsch-appreciation subculture excited about new britney spears novel
10378,cockatiel can't take a punch
10380,congress debates coolness of rush
10381,desperate obama just wants to know who to give weapons to in order to stop isis
10382,unemployed sibling makes last push for group mother's day gift
10383,couple always like this
10384,46-year-old spinster dies surrounded by cats
10385,facebook algorithm mortified it has to deliver up so much embarrassing news about own company
10386,rod stewart mistaken for elderly aunt
10387,tom clancy really happy with how latest video game with his name on it came out
10388,"'nothing ordinary' about multinational chain of pepsico-owned, mexican-themed fast food outlets"
10389,man regrets wasting money on college after failing to secure perfect dream life by 24
10390,seasonal depression to take over for chronic depression for a few months
10391,"'i look forward to ending my life,' says assisted suicide advocate before being shot out of cannon at brick wall"
10392,paul ryan awaiting soulcycle instructor's approval before accepting speaker role
10393,impoverished child in third world dreams about one day leaving light on for no reason
10394,corporation wants media company making branded entertainment to just have fun with it
10395,1-800-eat-shit finally publishes decades of reckless-driving data
10396,rwandan refugees angered over lack of aol access
10397,fatal spaz attack claims life of area spaz
10398,gop announces plan to go after obamacare
10399,breaking: we're doing a bad job
10400,1998 powerball winner returns to food-service job
10401,spouse under fire for telling anecdote wrong
10402,flustered mathematician unable to recommend good number
10403,much-criticized media vows to return to softball tactics
10404,oat farmer seriously thinking about getting into barley
10405,family of congressman glad he finally found outlet for his racism
10406,report: male hair loss 7 times more painful than childbirth
10407,mother still yammering away under her tombstone
10408,area new york times 98 percent unread
10409,wikipedia users surprised nobody's made page for john lennon yet
10410,fruit of islam cause man to soil fruit of looms
10411,area man demands more starches
10412,king ralph fails to become hip retro reference
10413,house haunted by elks club members
10414,two dead in 'kind of brutal' slaying
10415,nra visits colorado police evidence room to check up on rifle used in planned parenthood shooting
10416,child assured most monsters do not exist
10417,los angeles now 70 percent overpasses
10418,new lion tamer shocked by vast amount of paperwork
10419,no one notices area man's marginal attempts to change
10420,'diary of anne frank' found in attic
10421,perfect gentleman does not assault drunk woman
10422,world wildlife fund now just trying to get few nice photos of every species for posterity
10423,hand drum after hand drum emerges from vw bus
10424,barr releases catatonic mueller after removing all sensitive material from special counsel's brain
10425,app knows it's gone next time man needs space for photos
10426,cnn panelists warn north korea situation way too complex for them to discuss intelligently
10427,new prescription fish tank eliminates need for glasses while looking at fish
10428,pool noodle has another season in her
10429,giuliani: 'let's just start everything over'
10430,thing in cave not finished with eric yet
10431,12-year-old camper excited to meet girls who will torture her for rest of summer
10432,grandparents' cabinets contain brand of cookies previously unknown to humankind
10433,laid-off website designer designs website about being laid off
10434,chrysler names '83 lebaron ceo
10435,"wild, rutting animals pour onto prom dance floor"
10436,"dvd tries to pass off 'language options,' 'scene selection' as special features"
10437,romantic gesture too expensive to waste on current girlfriend
10438,"'as you can see, they are quite harmless,' says uber representative guiding detective through warehouse of sleeping autonomous cars"
10439,this first time area man hearing about daughter dating george zimmerman
10440,report: al-qaeda may be developing 'dirty soldier'
10441,startling report finds evidence democrats may have attempted to influence 2016 election
10442,gop promises americans will be able to keep current medical conditions if obamacare repealed
10443,new triple-x dinosaur park opens in nevada
10444,"scalia, thomas, roberts, alito suddenly realize they will be villains in oscar-winning movie one day"
10445,self-defense instructor simulates attacker right down to erection
10446,god shuts down andromeda galaxy
10447,dog keeps iceland awake all night
10448,frustrated man can't believe he can still hear construction worker hammering his wife at this hour
10449,corn lobby tightens the screws
10450,area man asked to shoot janice an e-mail
10451,patagonia introduces new high-performance jacket specially designed to protect wearer on walk between front door and car
10452,michelle obama admits barack had way too much sperm to make natural conception possible
10453,art student's nudes obviously drawn from hustler
10454,area man totally blows his chance to see 'exodus: gods and kings' in theaters
10455,ball park franks introduces new foot-wide hotdogs
10456,"mayonnaise, black forest ham to share top billing in upcoming sandwich"
10457,jim morrison stares creepily out of apartment window
10458,man trapped under boulder braces for possible good morning america interview
10459,business-owned women outnumber women-owned businesses
10460,diet candy's aftertaste experienced 12 years later
10461,starlet-viewer age difference quickly calculated
10462,budget woes force heaven to reduce eternal life to 500 billion years
10463,letter of recommendation clearly written under duress
10464,posthumously recorded bob dylan album receives rave reviews
10465,mtv movie awards snubs director jonas mekas yet again
10466,vatican unveils new rosary for windows
10467,picture of lemur printed for no goddamned reason
10468,"mayor hits on crazy idea of developing city's waterfront, green spaces"
10470,cbs to retain les moonves' services in smaller sexual-predator-at-large role
10471,"'it's a privilege to have worked with such talented people,' says coworker getting the fuck out of there"
10472,man wishes there was some sort of sign he could put on his house to let visitors know he has gone fishing
10473,bad to the bone to be used in film
10474,"human feet originally used for walking, anthropologists report"
10475,"fumbling, inarticulate obituary writer somehow losing debate to christopher hitchens"
10476,chuckling cops attempt to imitate sound of man being hit by taxi
10477,temporary worker permanently scarred
10478,nra calls for teachers to keep loaded gun pointed at class for entire school day
10479,toddler chokes to death on plastic taiwanese-made toy
10480,china slaughters population to control flu outbreak
10481,exhausted olympians wake up early to repeat opening ceremony for american time zones
10482,compromising company's values for advertising revenue referred to as 'partnering'
10483,salvation army clothing drop-off choked with stirrup pants
10484,calcutta fire marshal: many indian homes lack bride extinguisher
10485,area smoker one of america's top phlegm-producers
10486,npr's new format to feature soft-spoken white guys
10487,bounced joe biden check still taped up in delaware liquor store
10488,trump hacks through thick central american jungle in search of entirely new ethnic group to demonize
10489,pfizer breaks psychological need to always seek fda's approval
10490,report: grandpa just walks like that now
10491,family respects grandmother's wishes to have open-bloused funeral
10492,historical archives: one may now toil from home
10493,al-qaeda chatter deteriorates into gossip
10494,crestfallen 'unite the right' organizer eats swastika cake alone after no one shows up to his rally
10495,olympic drug testing official left horribly disfigured after coming into contact with russian urine
10496,presidential radio address pledge drive in its final day
10497,housing prices spike as tech employee takes stroll through neighborhood
10498,vast array of lip-balm options paralyzes shopper
10499,only way base jumper can get thrill these days is by jumping tandem with endangered species
10500,frank gehry no longer allowed to make sandwiches for grandkids
10501,friend wondering if you can catch him up on what happened in previous 7 seasons during 'game of thrones' title sequence
10502,local extension cord blasted for failing to reach outlet
10503,senate passes bipartisan resolution preventing themselves from stopping trump
10504,working artist has developed thick skin for sound career advice
10505,nabisco introduces x-treme salt-assault saltines
10506,jared kushner forced to follow along with ivanka's classified documents during meetings
10507,violence erupts at trump rally after supporters clash with protesting gop leaders
10508,"politician spots young female aide, and so it begins"
10509,coworker even a dick in his expense reports
10510,alec baldwin secretes own hair gel
10511,family figures grandpa never talks about wwii because nothing interesting happened to him
10512,local company introduces new take your daughter's friend to work day
10513,dzhokhar tsarnaev courtside at pacers-heat game
10514,heroic pants enter 19th day of continuous duty
10515,report: get back to fucking work
10516,word 'immunity' used outside of reality show for first time in five years
10517,jerky boys accidentally prank-call last remaining fan
10518,"best, most original idea man's ever had returns 114,000 google search results"
10519,laura bush suspects anniversary card penned by speech writer
10520,laura bush publishes courageous op-ed calling for imprisonment of whoever created ice
10521,nate silver ages 40 years after accidentally using polling projection model on self
10522,spy drone taken out of service after returning with creepy photos of insurgents changing
10523,coworker with two computer screens not fucking around
10524,hillary clinton inspires young girls to form presidential exploratory committees
10525,area dad figures he's got at least three more months of screwing around before son gains ability to form long-term memories
10526,"report: christ, someone actually brought their kid to this"
10527,autoplaying video executes cunning ambush 45 seconds after opening page
10528,god admits he too close to creation to judge whether it any good or not
10529,annual 6-sentence conversation with cousin goes smoothly
10530,man wearing sunglasses upside down on back of head still recovering from paul walker's death
10531,row of asterisks spices up otherwise ordinary e-mail
10532,terrorist plot foiled after concert security taps woman's purse
10533,exhausted robert mueller turns off phone to give himself breather from russia probe news over holiday break
10534,tiny dog suffocates in louis vuitton bag
10535,man reserving judgment on best actress nominees until looking at all 5 pictures
10536,fans excited as 'solo' trailer sheds light on specifically how it will suck
10537,personals ad takes hardline anti-fatties stance
10538,new pumpkin spice channel to offer fall-themed hardcore pornography
10539,teenage rebels seize control of food court's corner table
10540,gym teacher still remembers names of every former pantywaist
10541,'the bachelor' accused of leveraging his power as a reality tv star to lure 30 women to california mansion
10542,marvel hints at upcoming death of stan lee
10543,walgreens manager certain dead father would have been proud of crest toothpaste display
10544,advertising manager working hard to teach son value of an impression
10545,saudi arabia officially lifts ban on female monster truck rallies
10546,trump accidentally fires off 'boring mike pence' tweet during vp speech before he can stop himself
10547,u.s. continues dependence on foreign toil
10549,eminem horrified upon being informed that 'faggot' actually a harmful gay slur
10550,embarrassed sony ceo announces new video game system
10551,superhero never around when mild-mannered journalist david brooks is
10552,literary study finds all modern narratives derived from classic 'alien vs. predator' conflict
10553,someone filming b-roll at pike place market right now
10554,paul ryan cuts $120 million in wasteful spending from romney campaign
10555,vacationing man misses own remote control
10556,prince harry gets old suit tailored to wear to wedding
10557,petting zoo all goats
10558,"new study finds staring out from balcony with best friends strongest indicator that this your city, your time"
10559,area supervisor hates to break up little party
10560,johnson & johnson hoping brand won't be tarnished if they dip into lethal injection game
10563,meat industry introduces new easy-tear perforated beef
10564,media suffering through record normal temperatures
10565,woman finds imperfect mate at outlet mall
10566,man takes free thing he doesn't want
10567,veteran told what offends him
10568,trump boys sadly release pet alligator into lincoln memorial reflecting pool
10569,korean pop group bts shakes up lineup by adding really old guy
10570,"'it's just a costume, it's just a costume,' man nervously assures himself as giant hot dog starts walking toward him"
10571,clinton forced to kneel before zod
10573,"syrian rebels, government think it's about time to call syria a day"
10574,"'follow your instructions, this is all part of the plan,' hisses richard nixon tattoo protruding from roger stone's back"
10575,"nation's outfoxed sheriffs shake heads, throw hats in dirt"
10576,moderators give marco rubio 90 seconds to deliver closing statement of campaign
10577,"gene wilder to make horrible, horrible movie"
10578,area man tired of making excuses for rapist friend
10579,cash-strapped oscars to give out emmys
10580,dog chastised for acting like dog
10581,melania trump hosts state dinner in stunning black shroud of shrieking crows
10582,man can name all parts of the vagina
10583,poll: 96% of bands looking for slightly better drummer
10584,wife already knows the one thing she'll say that can never be taken back
10585,"nytimes.com's plan to charge people money for consuming goods, services called bold business move"
10586,judge pumps self up before verdict by listening to andrew w.k.
10587,83rd birthday party stretches definition of party
10589,fbi deputy director touched by heavily redacted farewell card from bureau coworkers
10590,justice scalia endorses new easton gaveling gloves
10591,losing-powerball-numbers announcement enters 17th hour
10592,man in break room can still hear time clock ticking loudly
10593,'game of thrones' fans excited to hear series will finally be over
10594,naked man mingles freely in locker room
10595,national archives clearly stored constitution in three-ring binder
10596,friends trying on each other's glasses revel in glorious mayhem of having slightly different prescriptions
10597,taco bell's five ingredients combined in totally new way
10598,no way old man in park not thinking about dead wife
10599,report: north dakota leads nation in parking availability
10600,dozens of social issues thankful they never had to go toe-to-toe with muhammad ali
10601,fingernail got fucking huge out of nowhere
10602,congolese civil war buff fights in civil war
10603,former big celebrity finds new career as pathetic former celebrity
10604,usda secretary rings nationwide dinner bell for y'all to get in here
10605,john ashcroft silences reporters with warning shot
10606,cnn accused of ignoring certain issues on anderson cooper 340°
10607,cackling mitch mcconnell reveals to stunned democrats he's been working undercover for republican party this whole time
10608,israel: palestinians given ample time to evacuate to nearby bombing sites
10609,red cross accused of wartime non-profiteering
10610,the edge still introducing self as such
10611,area man urinating like it's the best thing ever to happen to him
10612,seedless watermelon coming to grips with fact it'll never be able to have kids
10613,backup health care plan involves nation sharing one big jar of ointment
10614,no one at porn site responding to area man's bad link report
10615,florist saves abusive relationship
10616,sean spicer given own press secretary to answer media's questions about his controversial statements
10617,condo board member thinks bylaw cover-up might go all the way to deb
10618,microsft bids $2.1 billion for milton berle joke file
10619,giuliani demands mueller wrap up investigation and imprison president by september
10620,investors remind mark zuckerberg he can't fuck with them like the simpering cowards in congress
10621,stressed-out cvs back to selling cigarettes after only 3 months
10622,fda: juicy green apple conditioner best used with juicy green apple shampoo
10623,new demography today magazine targets demographer demographic
10624,clinton gets box to put government's stuff in
10625,north korea nukes self in desperate plea for attention
10626,"'becoming a mother has been the most thrilling experience of my life,' reports woman fleeing hospital with stolen baby"
10627,"honest, hardworking man leans against reliable pickup truck"
10628,"bodybuilder strong, but now what?"
10629,horrifying email from ex-girlfriend titled 'a few things'
10630,"agile, dynamic company able to respond to any challenge by laying off half of staff"
10631,shelter dog eating own shit not exactly doing itself any favors
10632,kid who mowed white house lawn to flip on trump
10634,punk band has something against local newscaster for some reason
10635,ns/nd/c/dwf wondering why she can't find someone
10636,bush proud u.s. economic woes can still depress world markets
10637,chris pine depressed by realization he could probably win governorship somewhere
10638,it's shark week!
10639,police found golden state killer by tracing owner of 'iamthegoldenstatekiller.com' website
10640,woman worried student loans could prevent her from one day owning entirely different kind of crippling debt
10641,barnes & noble staffers mock orson scott card crowd from back of room
10642,half-fabricated résumé still unimpressive
10643,slowly rotating pie a metaphor for trucker's failing marriage
10644,chicago man brushes mound of snow from beef sandwich before eating it
10646,mother's little angel just made fun of classmate's weight for 30 straight minutes
10647,"scientists: rich people, poor people may have shared common ancestor"
10648,"deformed, half-feathered audubon society president flees into forest after injecting self with bird dna"
10649,report: media coverage of bear attacks may be biased
10650,tale of how woman started making earrings out of scrabble tiles even more spellbinding than anticipated
10651,britney spears loses custody of child to in touch magazine
10652,florida passes strict ban on being unarmed
10654,asian man has thing for asian women
10655,authorities urge louisiana residents to evacuate dangerous lower income brackets
10656,death of sailor in iconic vj-day photo reminds americans of halcyon days when wars still ended
10657,woman who doesn't use facebook completely out of touch with friends' prejudices
10658,same americans who made taylor swift popular polled on constitutionality of health care reform
10659,michael jackson estate releases new documentary alleging king of pop gets lifetime pass for 'thriller'
10660,woman takes break from dating to focus on everything about herself no one could ever love
