,headline
3473,supreme court agrees to disagree on abortion issue
3474,214 executed in wacky bolivian prison mix-up
3475,taylor swift inspires 200 million fans to register to vote in tennessee
3476,asimo tricked into falling down stairs
3477,epa didn't know anybody was still drinking water
3478,cast-off paris hilton skin found in upper west side park
3479,"harper lee announces third novel, 'my excellent caretaker deserves my entire fortune'"
3480,new lover features 30 percent more cock
3482,aquarium unveils 'floating carcasses of the pacific' exhibit
3483,crowd of voters cheers patronizing rhetoric
3484,republicans address income inequality by offering middle class hot stock tip
3485,reminders of party's costume theme becoming increasingly more threatening
3486,alabama forced to release thousands of sex offenders after inmates deny charges
3487,libyans agree to come up with something for qaddafi to do all day in exchange for him leaving
3488,area cow doesn't suspect a thing
3489,spotify removes 'this is: white supremacy' playlist
3490,new 'phone book' raising serious privacy issues
3491,this absolutely the last time bouncer cleans up vomit
3492,joe walsh wakes up on stage mid-solo again
3493,psychopath joins fourth straight republican administration
3494,biggest guy in prison tired of every new inmate beating shit out of him on their first day
3495,japan spotted hovering over algeria
3496,"'no way to prevent this,' says only nation where this regularly happens"
3497,dick durbin wakes up chained to radiator with instructions to saw open own stomach to access kavanaugh report
3498,gun show vendor jokes with insane customer about how he hopes he's not insane
3499,53-inch child thrown from roller coaster regrets nothing
3500,"new app sends dating profile straight to friends, coworkers to laugh at without ever connecting users to each other"
3501,lesbian hen enjoying hen house
3502,"area man coasting by on good looks, work ethic, in-depth knowledge of virginia real estate law"
3503,local mother clips article about benefits of vitamin e
3504,five minutes of watching indian channel leads to five hours of watching indian channel
3505,president's cathartic words help nation begin to heal following yet another senseless 'saturday night live'
3506,ayman al-zawahiri delivers tedtalk on changing face of terrorism
3507,cool guy from middle school still sporting phat pair of jncos
3508,area man's knee making weird sound
3509,"mueller: 'well, we got the liar. probe's over'"
3510,new healthier menu features food wendy's customers bring from home
3511,national weather service releases composite sketch of tornado it believes ravaged midwest
3512,freak accident paralyzes man from waist up
3513,night of watching game show network leaves man concerned about life insurance
3514,"'we can have differences of opinion and still respect each other,' says betrayer of the one true cause"
3515,decorative throw pillow positively aching for a quick plump
3516,ice cube that man couldn't pry from tray lives to see another day
3517,homeless man has nice summer tan going
3518,white castle crave case handcuffed to wrist
3519,noncompete clause in lease bars tenants from living anywhere else for 90 days after moving out
3520,"hot wheels ranked number one toy for rolling down ramp, knocking over dominoes that send marble down a funnel, dropping onto teeter-totter that yanks on string, causing pulley system to raise wooden block, propelling series of twine rollers that unwind spring, launching tennis ball across room, inching tire down slope until it hits power switch, activating table fan that blows toy ship with nail attached to it across kiddie pool, popping water balloon that fills cup, weighing down lever that forces basketball down track, nudging broomstick on axis to rotate, allowing golf ball to roll into sideways coffee mug, which tumbles down row of hardcover books until handle catches hook attached to lever that causes wooden mallet to slam down on serving spoon, catapulting small ball into cup attached by ribbon to lazy susan, which spins until it pushes d battery down incline plane, tipping over salt shaker to season omelet"
3521,north dakota flooding reminds people of north dakota's existence
3522,man looks on helplessly as variants of his nickname evolve and multiply at breakneck speed
3524,alumni furious over high school's constant improvements
3525,report: women only made up 2.7% of video game bosses last year
3526,religious pamphlet sat on
3527,betty friedan honored with second-class postage stamp
3528,10-pack of swiss miss bracing itself to shoulder burden of holding together man's depressing holiday alone
3529,white house guidance counselor recommends clinton consider career in hotel management
3530,munchstrosity created in frito-layboratory
3531,archangels already sick of cardinal o'connor telling them how they do it in new york
3532,philippine mud wins in landslide
3533,giddy thom yorke goes to bed early to make grammy day get here sooner
3534,man escapes eritrean civil war to clean martini puke from back of taxi
3536,study finds 87% of knowledge about nation comes from side of u-haul trucks
3537,bianchi introduces new bike for blocking commuters on subway during rush hour
3538,corporate retreat teaches employees how to dick around as team
3539,societal collapse narrowly averted after man honks horn at car paused at green light
3540,this absolutely the last time bouncer cleans up vomit
3541,loser congressman carries around pocket-sized version of constitution everywhere
3542,bush seeking non-masturbating surgeon general
3543,area christian forgives you
3544,study: average person's life plan can only withstand 25 seconds of direct questioning
3545,mlk's family urges nation to spend anniversary of his death twisting his words to fit own political agendas
3546,woman mentally rearranging rankings of children while opening mother's day gifts
3547,man beginning to worry that best meals already behind him
3548,verizon introduces new charge-you-at-whim plan
3549,british girl exotic enough
3550,nation's sleep experts recommend cutting down on strobe light before bedtime
3551,annoying coworker insists on existing right in visual range
3552,man halfway down giant water slide remembers today 9/11
3553,film critic belatedly comes up with swordfish zinger
3554,ecuadorian embassy runs ad seeking 'no drama' tenant for newly vacant room
3555,dying mastermind pulls red lever
3556,xabraxian astronomers discover new planet
3557,world's marine life on edge now that seaworld moving on from orcas
3558,trump's prefrontal cortex admits it can't possibly filter all impulsive comments coming from rest of brain
3559,nation's pansies announce plan to slowly acclimate to pool
3560,queen elizabeth hides out in bushes to catch whoever keeps stealing packages from buckingham palace porch
3561,laura ingraham claims protesting parkland students don't have enough gun knowledge to criticize nicholas cruz
3562,obama's aunt sends him article mentioning united states
3563,trump warns removing confederate statues could be slippery slope to eliminating racism entirely
3564,study: floating heap of trash now ocean's apex predator
3565,jared kushner assures reporters he never revealed state secrets without turning huge profit
3566,facebook offering new profile frame to let friends know you stopped scrolling briefly to look at disaster photos and felt sorta bad
3567,cow excited to freak the fuck out during solar eclipse
3568,new evidence suggests first gallows created as early attempt at autoerotic asphyxiation
3569,4 senators mauled during congressional tiger show
3570,area man could use the overtime anyway
3571,"startup very casual about dress code, benefits"
3572,"area man sorry he's late, got here as fast as he could"
3573,embarrassed snake can't believe documentary crew caught it whiffing while lunging at toad
3574,report: 58% of world's japanese speakers white 23-year-old american males
3575,alex rodriguez pulls out of world baseball classic because everyone else is doing it
3576,small town honors once-ostracized artist
3577,next generation to take a pass on aerosmith
3578,nation gets really tired all of a sudden
3579,30-year-old nes still wasting life playing video games
3580,garage orchestra hands out demo at boston philharmonic show
3582,"'wait, mr. bezos, you forgot your tax subsidy!' says andrew cuomo running behind limo"
3583,2012 prius to feature rudimentary reproductive system
3584,wal-mart bans semi-nude pantyhose
3585,your kids: are they sexy enough?
3586,man at gym apparently comfortable standing naked right in middle of spin class
3587,grieving nation solemnly waits extra day for their amazon shit
3588,"ex-wife, divorce lawyer killed as model train careens off tracks"
3590,ghost of carl sagan warns against dangers of superstition
3591,"report: 40,000 people died on ferris wheels this summer"
3592,kids love when mom sad enough to just order pizza
3593,everyone giving up on john after latest movie recommendation
3595,movie characters happen to pass through pamplona on the one week bulls run
3596,high school bully worried victims will realize he actually retarded faggot himself
3597,15 cnn ireporters killed in afghanistan
3598,man on weird fad diet where he eats flavorful meals that make him feel good
3599,brian williams retreats to mountainside hut to meditate on fickle nature of truth
3600,woman injured in hostile makeover
3601,bus rider acting like fight not happening 4 feet away
3602,bill gates' wife worried he's lying in a ditch full of money somewhere
3603,out-of-control hand gesture sends bernie sanders tumbling off stage
3604,tucker carlson challenges alexandria ocasio-cortez to a date
3605,breaking: waiter picking up napkin with bare hand
3606,hurricane bitch hits florida
3607,content writer awkwardly shows parents around website where he works
3608,rick perry apologizes for trying to outdo fellow cabinet members by using $72 million of taxpayer funds on lampshade
3609,buddy system responsible for additional death
3610,judge totally understands where defendant is coming from
3611,heroic broken sewage pipe floods congress with human waste
3612,hillary clinton issues single-word victory speech following super tuesday results
3613,same homeless man always begging for change on united flight
3614,brad pitt called before congress to testify about bicep regimen
3615,romantic prince harry surprises meghan markle with family's heirloom colony
3616,neurologists find brain still shows signs of self-criticism minutes after death
3617,family receives 38-piece astrazeneca assorted pill sampler
3618,man removing sweatshirt offers coworkers tantalizing glimpse of bare midriff
3619,glade introduces new spring meadow fire extinguisher
3620,kerry's face droops with joy over latest polls
3621,nation's teen drug problem ended by rapping cartoon spokesbeast
3622,months of painstaking practice critiquing celebrity fashion comes down to this for area woman
3623,14-hour labor not exactly cakewalk for baby sticking halfway out mother's vagina either
3624,lone superdelegate voting for martin o'malley feels like total fucking idiot
3625,conservative floridian enjoys living under sharia law more than he thought he would
3626,report: attempting to prove masculinity results in over 8 million pulled muscles per year
3627,expense-account wizard transforms prostitute into color copies
3628,toddler makes convincing case for being afraid of horse
3629,new study finds humans shouldn't spend more than 5 consecutive hours together
3631,nation's debate viewers disgusted with selves after connecting with mitt romney
3632,obama purchases ad space on side of mccain's bus
3634,liquor commercial featuring dance party on pirate ship also includes important message about responsibility
3635,moon now overrun with cane toads after species accidentally introduced into environment during apollo 17 mission
3636,obama proposes tax increase on meanest 2% of population
3637,report: most americans have enough saved for retirement to live comfortably on streets
3638,beto o'rourke announces he starting obama cover campaign
3639,nation admits it always a little bored by whole jimmy hoffa thing
3640,woman shouts down hall for boyfriend to come kill giant ax murderer she found in bedroom
3642,sen. dick lugar placed on congressional disabled list with strained hamstring
3643,elderly man hailed as alert
3644,denny's introduces 'just a humongous bucket of eggs and meat'
3645,live cow lowered onto floor of u.s. house of representatives
3646,area grandparents still have no idea what grandson does for a living
3647,chuck schumer: 'the american people deserve a president who can more credibly justify war with iran'
3648,congress continues debate over whether or not nation should be economically ruined
3649,india holds 5k stampede for charity
3650,shannon tweed named head of u.s. task force on nudity & aging
3651,teacher grading papers next to you on plane not pulling any punches
3652,jim acosta immediately decks white house intern after being let back into press pool
3653,spawn of satan a failure in father's eyes
3654,"americans urged to get saving $30,000 out of way before obamacare repealed"
3655,romney celebrates florida win with all-night miami beach rave
3656,roommate cooked enough of gross thing for everyone
3657,bruce springsteen accidentally plays 'big government's stealin' our livelihood' at obama rally
3658,new hobby sucks
3659,new teen trend 'walking wet and nude' couldn't have caught on at worse time
3660,department of education hires art teacher to spread evenly across all u.s. public schools
3661,crowd at trump rally realizes they've been chanting 'we are frightened and helpless' for last half hour
3662,billy joel has billy joel's disease
3663,connecticut man visited by being from another time zone
3664,report: chip in mug right where mouth goes
3665,study finds majority of accidental heroin overdoses could be prevented with less heroin
3666,georgia governor signs bill outlawing abortion except for single 30-second window on third day of fourth week of pregnancy
3667,"millennium actually starts in 2001, terrorists note"
3668,"'i want to congratulate the president,' romney says in 240,000th and final lie of campaign"
3669,secretary of interior announces $400 million initiative to preserve self for future generations to enjoy
3670,"peeps unveils new boneless, skinless marshmallow breasts"
3671,bush: 'history cannot judge me if i end it soon'
3672,bored 4-year-old mixes things up by watching movie she's only seen 97 times
3673,embarrassed cdc announces it accidentally switched flu shots with hiv
3674,condoleezza rice's lunch missing
3675,nato airstrike destroys key taliban day care center
3676,police department deploys fancyclothes cop
3677,"park rangers lance old faithful in effort to pop clogged, inflamed geyser"
3678,"as election draws near, area man moves to all-obama t-shirt rotation"
3679,colorful multicultural mural celebrates diverse lack of talent
3680,hillary clinton: 'young girls should have an equal opportunity to one day feel power coursing through their body'
3681,eighth-grader drinks at twelfth-grade level
3682,possum gazes longingly at family walking dog
3683,bush acquired by martian zoo
3684,report: only predictor of happy marriage is if husband ever won wife big stuffed animal at amusement park
3685,"sickly, starving rhino not as fun to hunt"
3686,historians reveal thousands of immigrants were forced to change hairstyle at ellis island
3687,flood of cheap afghan heroin to arrive just in time for recession
3688,couple spends morning at farmers market verbalizing everything that comes into field of vision
3690,man's relationship advice same as his hunting tips
3691,kfc responds to stockpiling trend with 576-piece bucket
3692,nine-hundred-pound man left to die
3693,roommate skulking around edge of party like victorian ghost child
3694,man thinks receptionist is hitting on him
3695,swans in committed relationship barely ever arch necks into heart shape anymore
3696,report: apocalypse actually happened 3 years ago
3697,man who lost leg to whale decides to let it go
3698,"woman's body confusing jumble of celtic, egyptian, japanese symbols"
3699,high-end persian rugs attend trial in show of support for paul manafort
3700,uneducated nba star urges kids to stay in school
3701,tomato genetically modified to be more expensive
3702,area man wins conversation
3704,hunter s. thompson shoots mouth off one last time
3705,directions to ed's steak house
3706,fountain simulates vomiting lion
3707,television executive's baby cancelled in development stage
3708,god scores another free balloon some dumb kid let go of
3710,area man's recommended daily caloric intake exceeded by 9 a.m.
3711,college roommates surprised to find dorm room has one king-size bed
3712,tornado creeped out by man who keeps following it in truck and filming it
3713,"fbi raids michael cohen's office to get closer look at his innovative, thorough legal work"
3714,"'without them you could buy anything,' whispers amazon echo as man stares blankly at family"
3715,"paper towels on amazon surge to $2,000 a roll after crippling cost increase of paying workers a living wage"
3716,lazy fda approves x-ray vision pills
3717,produce manager ready for some football
3718,heartfelt apology robs man of cherished grudge
3719,secretary of education reveals she's forced to use own salary on yacht supplies
3720,hbo film reveals liberace was good friends with gay men
3721,report: none of the 31 americans qualified to be president running this year
3722,"executive, legislative, judicial branches merge"
3723,new roommate excited to bring robust puttering experience to apartment
3724,norah jones releases debut album for third time
3725,area film buff wondering what pauline kael would say about cookie's fortune
3726,report: nuclear arsenal will go bad unless used by 2000
3727,great mosque of mecca hosts annual christmas tree lighting
3728,facebook user verifies truth of article by carefully checking it against own preconceived opinions
3729,"aging succubus lowering standards for men ever since she turned 40,000"
3730,mankind tired of having to remind itself of good in world
3731,magical homeless man turns spare change into vomit
3732,baby's third through eighth words registered trademarks
3733,"papa john's comes under fire for cruel treatment of the bulbous, deformed creatures that lactate pizza sauce"
3734,freakonomist keeps close eye on ge stock versus height of mexican weightlifters
3735,local history museum really digging deep to fill 2 15-by-20-foot rooms
3736,area wildcat a real wildcat in the sack
3737,republicans give in right before obamacare would have been repealed
3738,"youtuber cringing while watching amateurish early, current work"
3739,roy moore under fire for new 'children are my future' ad campaign
3740,doctors reveal dick cheney burning through at least 3 hearts each week
3741,god hurting after eating 20-piece spicy angel wings
3742,neighborhood would make a great video game level
3743,styrofoam to spend next 500 years reflecting on how well it protected blender in transport
3744,75% of party trolley defaulting on student loans
3746,eggs good for you this week
3747,red lobster celebrates return of annual all-you-can-eat krill fest
3748,same jumbotron used for marriage proposal used to ask for divorce
3749,thousands of new orleans households still without political power
3750,new obesity drug delicious
3751,fantasy football star confident he can make leap to general manager of nfl team
3752,"abortion doctor's murder sparks waves of calm, rational discussion"
3753,dad way scarier when controlling temper
3754,tv commercial for beverage features woefully reckless pouring technique
3755,tire salesman to hit them with a little razzle-dazzle
3756,report finds one in five americans struggle with properly masking depression
3757,paramount home video pleased to bring man feature presentation
3758,college newspaper staff know exactly how they would respond if editorial freedom challenged
3759,treasury department releases new 'monsters of the silver screen' $20 bill
3760,"obama, romney urge americans to purchase 'the onion book of known knowledge'"
3761,unattractive man not fooling anyone by dressing well
3762,former president carter sole attendee at 1997 solar power summit
3763,area man uses wtc attack as excuse to call ex-girlfriend
3764,panicking romney attempts to lay off debate moderator
3765,open-minded man would be willing to look past jennifer lawrence's flaws
3766,mueller immediately regrets coercing michael cohen to flip on trump after having to spend time with him
3767,elderly man feeling useless in retirement wishes he could go back to feeling useless at work
3768,woman wearing jacket indulging in forbidden pleasure of having pockets
3769,magical voting booth transforms clearheaded americans into reactionist morons
3770,museum proudly exhibits picasso shitty enough to be in kansas city
3771,"george clinton, della reese meet to discuss key hairstyle issues"
3772,sitting inside cardboard box the safest 6-year-old will feel for remainder of life
3773,melania trump straightens husband's neck skin before walking out onto inauguration platform
3774,catholic church brings in new perspective on solving abuse scandal with appointment of toddler bishop
3775,"nation dutifully gets in cars, stands in line, watches new star wars movie"
3776,update: 'the onion' apologizes for killing innocent boston man tom mahoney
3777,paleontologists determine dinosaurs were killed by someone they trusted
3778,man with new generator hoping for power outage
3779,six-year-old announces plans to become ballerina gymnast veterinarian horseback-riding princess
3780,ryan gosling sneaks past paparazzi in full-body red carpet camouflage
3781,onion social defends decision to remove 'you will live' promise from mission statement
3782,nation to wait for more facts on texas shooting before doing absolutely nothing about it
3784,expressing deeply held political opinion referred to as 'gaffe'
3785,old friend avoided in hometown convenience store
3786,bush sr. apologizes to son for funding bin laden in '80s
3787,report: suddenly remembering to sit up straight once a month best way to keep back healthy into old age
3788,wrong turn finds man on poor side of mall
3789,fucker sure taking long time to download
3790,giuliani clarifies he doesn't want gravestone to say 'he married his cousin' either
3791,historical archives: immoral woodcut discovered in hay loft
3792,troubling study finds majority of americans who got it aren't flaunting it
3793,study finds americans do most financial planning when figuring out how to get money's worth at buffet
3794,freelancer loves being able to barely scrape by livelihood on own schedule
3795,baby new year abandoned in street
3796,mike pence breaks out formal altar boy robes for state of the union address
3797,lone geek sits off by self reading the silmarillion throughout recess
3798,mccain speechwriter trying to write lines that don't lead to creepy smile
3799,'i am under 18' button clicked for first time in history of internet
3800,breakthrough drug eliminates crying in infants
3801,police use exact right amount of force to subdue suspect
3802,man has trouble growing full beard of bees
3803,fruit of islam cause man to soil fruit of looms
3804,tommy lee jones tells jimmy fallon he doesn't want to play any of his little fucking games
3805,"deceitful woman deviously alters appearance to give illusion of youth, fertility"
3806,"shit, guy in front of you ordering for entire construction crew"
3807,kiss with wife pretty good
3808,bill clinton has unibeam installed in chest
3809,employee totally crushes presentation of idea that will soon bankrupt company
3810,rangers disgusted by prince fielder leaving chewed-up bats all over dugout
3811,'farm aid aid' concert to benefit struggling farm aid concerts
3812,domino's introduces thanksgiving feast pizza
3813,fifth-grader writes 'mrs. alan greenspan' all over her notebook
3814,grandfather tries to make first fall as cool-looking as possible
3815,hilary duff's number-one fan tasered
3816,superstitious clinton refusing to change her beliefs following hot streak in polls
3817,report: only 3% of conversations actually need to happen
3818,real-life scene filled with product placement
3819,camel cash inherited from grandpa
3820,kate middleton feels royal baby kicking during queen's coronation anniversary
3821,child abuse: how much is too much?
3822,"well-meaning mouse wouldn't really call self a 'pest,' per se"
3823,chris christie dreaming about 72-inch springsteen sub
3824,earliest known t-shirt found
3825,"disgusting, unusable shopping cart has single sprig of parsley in it"
3826,25-pound ham wedged in parents' refrigerator
3827,surgery required for new sexual position
3828,dishwasher broke
3829,"online activists unsure about offensiveness of article, figure they'll destroy author's life just in case"
3830,nation's grandfathers to receive annual shipment of $2 bills from u.s. treasury
3831,mediocre painter's true talent lies in acting like a painter
3832,man returning from vacation settles on single concise anecdote he'll tell everyone who asks
3833,tucker carlson spends entire show screaming over child bride he invited on to debate him
3834,area desk doesn't mind if people sit on it like a chair every once in a while
3835,lure of free meal each shift too great for disgruntled arby's employee
3836,new dating site matches users with partners they deserve
3837,cleveland indians owner admits chief wahoo no longer compatible with modern revenue growth expectations
3838,"'the president can suck my big fat dick,' says rex tillerson in veiled attack on trump"
3839,complex human being reduced to 'gutter guy' for purposes of to-do list
3841,"routine, affordable medical procedure put off another year"
