,headline
6896,polite high school football team runs around banner that took hours to make
6897,historic senator robert byrd imploded in controlled demolition
6898,report: it going to take way more than an inconceivable act of violence for country to rise above politics
6899,unconsciousness faked to make anesthesiologist feel better
6901,cost of freedom at all-time high
6902,physics t.a. not born in u.s.
6903,boss makes lipstick prints on paychecks for valentine's day
6904,trump bestows medal of honor on john mccain's tumor
6905,man doesn't realize date went terribly
6906,ty cobb returns to old private practice in enchanted forest toadstool
6907,man trying to leave hateful message at local synagogue frustrated phone line always tied up with other threats
6908,woman injured in hostile makeover
6909,eighty percent of al-qaeda no. 2s now dead
6910,"foie gras, scallops snuck into opera house"
6911,paul manafort trying to ferment vintage cheval blanc in toilet tank
6912,woman seamlessly transitions from being too hungry to focus on job to being too full to focus on job
6913,weird new cereal sets tone for first weekend at divorced dad's
6914,balloon deliveryman forced to take bus
6916,letter from employer thankfully omits balls-copying incident
6917,cancer walk goes under 15-straight miles of high tensile power lines
6918,"nation offsets carbon footprint by planting single 300,000-foot-tall tree"
6919,teen's natural drive to murder sexual rivals successfully channeled into 'super smash bros.' victory
6920,area dad botches 'princess bride' quote
6921,siblings each hoping other one will take care of aging parents someday
6922,federal troops seize neglected child in pre-dawn raid
6923,baltimore named city with best quality of pigeon life
6924,republican establishment quietly relieved party no longer their responsibility
6925,california to allow prisoners to serve sentences online
6927,"new rnc ad endorses roy moore: 'he's a scumbag, but he's our scumbag'"
6928,secret police enforce mourning of deng xiaoping
6929,'boating world magazine' giving live updates as its team of reporters reads all of mueller report
6930,each line of mastercard billing statement evokes infuriating vacation memory
6931,civilian casualty flattered to have been mistaken for hamas leader
6932,nra says parkland students should be grateful for guns giving them such a memorable bonding experience
6933,"woman longs for caress of boyfriend's dry, cracked, bleeding hands"
6934,"uma thurman, ethan hawke to sire new race of homo celbritans"
6935,jimmy buffett pays for own drink for first time in 17 years
6936,alcoholic recovered
6937,kidnapping going pretty smoothly
6939,authorities not even going to bother looking for motive behind oregon shooting
6940,rock fans outraged as bob dylan goes electronica
6941,white castle bathroom stall celebrates 5th conception
6942,oakland teacher mistakenly teaches 'economics'
6943,teamwork mostly karen
6944,sarah huckabee sanders strongly rebukes implication she doesn't lock own children in cages
6945,50-year-old prince licks aarp representative's face
6946,ice agent can't believe he being reprimanded for child who died all those months ago
6947,arne duncan stressed about preparing for standardized secretary of education exam
6948,mike pompeo defects to north korea after learning about kim jong-un's torture program
6949,"earth safe, but for how long?"
6950,'what if we put m&m's on top? would they eat that?' doritos exec wonders out loud
6951,crush on williams-sonoma employee costing man a fortune
6952,study finds leading cause of depression hearing words '2016 frontrunners'
6953,america's love affair with jim breuer to start any day now
6954,u.s.–cuba relations end after obama hit by foul ball at exhibition baseball game
6955,state's abortion waiting period allows women to explore alternatives to making their own decisions
6956,man takes sober moment to reflect on fact that most of meal already gone
6957,new hampshire primary excites tiny percentage of population who even cares what happens anymore
6958,plant dead because of you
6959,man pinned under blankets for three days
6960,smiling nation takes moment to enjoy thought of what rnc headquarters like right now
6961,wondrous world of fishes last checked out 4/17/67
6962,german auto engineer issued lab coat
6963,baltimore preparing for hurricane joaquin by adding second layer of plywood to shuttered small businesses
6964,area woman decides not to post facebook status that would have tipped gun control debate
6965,microlender forecloses on goat
6966,deer shot by obsessed fan
6967,parents' visit injects $66 into local apartment economy
6968,teen reports saturday night live has sucked since chris kattan left
6969,report: majority of time in pool spent urging others to enter pool
6970,glimpse of gene shalit on tv reminds woman it's time for bikini wax
6971,home-brewing phase comes to long-overdue conclusion
6972,exhausted florida resident returns home after weathering harrowing week with family out of state
6973,burglar makes sure to crack glass on family portrait
6974,alderman has that zoning dream again
6975,"former marine sniper slapped with 3,000-yard restraining order"
6976,"gay gene isolated, ostracized"
6977,subwoofer worth the horrible credit rating
6978,"'chapter 1: clark,' reports awful manuscript"
6979,biden puts on lucky debate suit
6980,milosevic confesses to crimes against subhumanity
6982,authorities abandon search for missing girl after finding huge bass while dredging lake
6983,special ops veteran slips back into family undetected
6984,groundbreaking young adult novel features protagonist who's a bit of a loner
6985,authorities warn denver residents in direct path of 2037 hurricane alba
6986,suri cruise somehow already 11
6987,"sweating, shaking man never going to spend a little time with his thoughts again"
6988,couple on verge of breaking up has mind-blowing aquarium visit
6989,dad receives advance intelligence on visiting son's new eyeliner
6990,"roommate not seen for, like, five days"
6991,boy's whale-song imitation not helping anything
6992,mom really funny today
6993,fixin's added to food pyramid
6994,pbs moderators spend first 10 minutes of debate asking candidates for fundraising advice
6995,90 percent of americans now wearing laminated id badges
6996,café adds heartbreaking little lunch menu
6997,study: average american has over 9 million imagined sexual partners in lifetime
6998,north korea ranked least-entertained nation on earth
6999,can the american idol 2  winner end kelly clarkson's pop-chart dominance?
7000,freedom-wielding high schooler freedoms down 16 classmates in latest mass freedoming
7001,annoying coworker precedes all nouns with 'quite the'
7002,aides advise obama to avoid any mention of america during state of the union speech
7003,redundancy built into tv show to protect against failure
7004,obama still hasn't figured out how to adjust height of oval office desk chair
7005,ruth bader ginsburg debating whether to cancel winter vacation climbing k2
7006,u.s. consumer confidence shaken after mom buys wrong kind of tortilla chips
7007,"area man to ask his doctor about xenical, propecia, claritin, paxil, drixoral, lipitor, tavist-d"
7008,office manager forced to resort to unfriendly reminders
7009,"couple should get dinner with other couple, couple reports"
7010,man cautiously avoids barnes & noble section where teens check out graphic novels
7011,study finds 79% of statistics now sobering
7012,co-op casino robbed again
7013,man treats mother to detail about his personal life
7014,man's wife dies of cancer just like in the movies
7015,man puts glass of water on bedside table in case he needs to make huge mess in middle of night
7016,woman on first date feels like she could spend whole life in uncomfortable silence with this man
7017,tall young girl told she should play basketball
7018,salamanders bravely offer to go extinct in place of better animal
7019,disappointing buffalo wild wings not living up to ridicule
7020,fda recalls food
7021,'new york times' reader stoked after noticing article penned by favorite reporting duo
7022,weird debate viewer using tonight to inform herself about candidates' policy stances
7023,new drug offers hope to infertile inner-city teens
7024,sensitive scientists report 5 in 5 women don't know how beautiful they are
7025,chris christie emits loud sob as paul ryan asks crowd whether they worse off now than they were 4 years ago
7026,rock song takes pro-rock stance
7027,"deaths of 550,000 confirm which mushrooms are okay to eat"
7028,'i'd like the crispy chicken sandwich' first truthful thing man has said in weeks
7029,fema unveils nationwide phone tree in case of emergency
7030,increasing number of americans unable to point out map
7031,area woman said 'sorry' 118 times yesterday
7032,crowd feeling kind of silly now after spending all that time pleading rooftop sniper not to jump
7033,report: universe to end next friday
7034,"protagonist rapidly getting dressed must be late, reports cunning viewer recognizing film's subtext"
7035,supposed adult pays man to sit in room and listen to him talk about his feelings
7036,god humbled to be the answer to 'jeopardy!' clue
7037,"beanie baby collection stares at owner with 226 cold, dead eyes"
7038,john kelly roots out remaining priebus sympathizers hiding in tunnels throughout white house
7039,christopher cross finally reaches mexican border
7040,report: average consumer puts blind faith in 87 corporations per day
7041,scientists pinpoint part of brain all your hair grows out of
7042,alabama begins offering tax credit to attract more youtube fail compilations to be filmed in state
7043,mandatory unisex golden globes uniforms keep focus on stars' work
7044,cast of 60 minutes suffers collective stroke
7045,viral video sparks national debate around drumming in public
7046,plo claims responsibility for bombing of krippendorf's tribe
7047,shower caddy coated in dazzling multicolor array of various soap films
7048,"advisors tell trump, cruz to stick to just attacking all women in general"
7049,unmanned military drone briefly grasps senselessness of war
7050,dad frees up entire day to spend on quality father-grill bonding time
7051,rex tillerson blindsided by news he still works for state department
7052,coy 'dexter' producers hint at 'huge plot holes' in season finale
7053,attempt to buy gift for boyfriend results in hatred of boyfriend
7054,woman comes forward with first allegations of biggest sexual harassment scandal of 2036
7055,cash-strapped npr launches 'a couple things considered'
7056,report: tiger that mauled roy horn still struggling to find work
7057,report: many americans not watching enough television to make worthwhile contribution to small talk
7058,google now giving female employees free day each week to work on lawsuits
7059,casual sex surprisingly formal
7060,economists advise nation's poor to invent the next facebook
7061,area man's hairstyle history eerily mirrors kevin bacon's
7062,woman dots her 'i's with cute round marks
7063,man nothing but lumbering golem of rewards cards
7064,report: nation secretly hoping dads die first
7065,goddamn findings fail to support researcher's hypothesis
7066,lindsay wagner to star in anything offered her
7067,cnbc: 'anyone who owns a suit can come on television'
7068,pope francis asks congregation if it's okay if they do a low-key easter this year
7069,mathematician has popular equation stuck in head all day
7070,"hot, sweaty jane fonda wondering if that's the best delivery boy's got"
7071,second-grade music student goes nuts with cowbell
7072,hulk hogan donates hair to lucky locks of love recipient
7074,visa fires bob dole
7075,family fears grandmother aware of her surroundings
7077,desperate barnes & noble to give unlimited free tablets to anyone who walks in store
7078,trump fulfills campaign promise of pushing major immigration decision on someone else so he can watch tv
7079,guantánamo prisoners released into cheering dnc crowd
7080,audubon society revokes black-capped chickadee's membership after species fails to pay dues
7081,asexually reproduced sea sponge worried she's turning into herself
7082,fec extends election by 7 months to give nation chance to better get to know candidates
7083,gondolier ordered to follow that gondola
7084,area man unsure whether he's on right bus for most of trip
7085,woman happy to have such good takeout places she can call when feeling low
7086,trump confident u.s. military strike on syria wiped out russian scandal
7087,important decision sent up to company's highest idiot
7088,scientists working on immortality better hurry up because ian mckellen is 73
7089,"internet crashes as billions of people go online to purchase the onion's latest book, 'the trump leaks'"
7090,white house flag now moving minute to minute to indicate trump's mood
7091,unstoppable killing machine out of toner
7092,tourist realizes it's all just a lie set in place for him
7093,location of newest mass shooting revealed
7094,woman all geared up to complain about work sidelined by friend with marital problems
7095,historians still unable to determine how americans were able to build hoover dam
7096,fox news channel adds laugh track
7097,nervous voter totally blanks on american values while looking at ballot
7099,roomba thrown out of home after being caught staring at sleeping daughter
7100,"new ketchup gets horrifying look at grisled, almost empty bottle it replacing"
7101,5-year-old admits it pretty messed up spider-man visiting his birthday party when he could be out saving lives
7102,kasich privately worried he'll never have charisma necessary to incite supporters to violent frenzy
7103,"cat looking out window, bird form unbelievably intense fifth-of-a-second bond"
7104,ups reports troubling drop in residents answering doors in lingerie
7105,enraged man unable to break tv
7106,donald trump spends another valentine's day completely alone
7107,cosby lawyer asks why accusers didn't come forward to be smeared by legal team years ago
7108,'make daddy die' whispered into build-a-bear
7109,"bush, cheney stand back-to-back, cock shotguns one last time"
7110,exhausted studio has done all it can in terms of building excitement for 'the lincoln lawyer'
7111,hanson sweeps 1998 nambla awards
7112,heavenly sources confirm joe jackson already screaming at michael
7113,all the good sentiments on 'get well soon' card already taken
7114,yalie strikes harvard lad sharply about the face and neck
7115,report: majority of married people get up and go to second family's house as soon as spouse asleep
7116,t.j. maxx job application just asks prospective employees how much they plan to  shoplift
7117,study finds 80 percent of facial hair being silently judged at any one time
7118,9-foot-tall bernie sanders greets supporters after session with posture coach
7119,grown man purchases 37th sailor moon figurine
7120,thousands of students forced to attend iowa state after university sets acceptance rate to 140%
7121,frustrated men demand to know 'exactly where on tits it okay to touch nowadays'
7123,fda approves new drug for treatment of social anxiety
7124,new polls increase fears that midterm elections will be won by wave of politicians
7125,trump administration urges saudis to stick to killing random yemeni civilians
7126,dzhokhar tsarnaev rushes out of summer class to make court hearing
7127,u.s. retakes top spot in annual 'party country' rankings
7128,mc serch updates list of gas-face recipients
7129,raccoon crushed to death by garbage truck hits jackpot with reincarnation
7130,new speech recognition software factors in user's mouth always being full
7131,"'100% of teenagers huge fucking assholes,' confirms study by sobbing, red-faced scientists"
7132,steven spielberg criticizes netflix for ruining golden age of pandering big-budget corporate films
7133,"eleven-year-old has miniskirt, pumps, vague notion of what sex is"
7134,nation not sure how many ex-trump staffers it can safely reabsorb
7135,nation can't wait to wake up and start eating again
7136,political scientists trace american democracy's severe polarization to fucking idiots on other side of aisle
7137,mta official too nervous to tell commuters waiting for train that service shut down permanently an hour ago
7138,chris hemsworth deputizes hunk to assume 'sexiest man alive' duties in his absence
7139,area dad suffers massive nothing to worry about
7140,lazy daredevil to lie across 12 couches
7141,aspiring actor dreams of one day publicly voicing regret for working with woody allen
7142,u.s. won't rule out escalating defense-sector profits from syria conflict
7143,woman could listen to british guy scream for help all day
7144,dare graduate celebrates first toke
7145,charles durning hocks up four-pound chunk of phlegm
7146,tesla debuts carless driver
7147,tony randall secedes from union; declares himself independent nation of randalia
7148,visibly flu-stricken choir kid really dragging down whole christmas pageant
7149,white house declares war on dsl provider
7150,bush lets war widow punch his arm once
7151,couple has nest egg of debt to make sure they've got some money to owe down the road
7152,iggy pop only one allowed in grocery store shirtless
7153,sheepish secret service agent can't explain how vacuum cleaner salesman got into oval office
7154,elderly woman applying makeup most heartbreaking thing on earth
7155,auction won by crab with $20 stuck in claw
7156,report: there must be some trick to unfolding table legs
7157,man thinks going to vegas for things other than gambling somehow less sad
7158,scott walker changes locks on wisconsin governor's office
7159,movie studio blows whole budget on big-name gaffer
7160,'run! run and never look back!' whispers heidi cruz while hugging carly fiorina on rally stage
7161,hero firefighter: 'i'm a hero'
7163,"obama sort of freaked out after not receiving single e-mail, phone call for entire day"
7164,best thing that ever happened to area man yelling at him about socks
7165,new study finds majority of god's blessings burn up on entry into atmosphere
7166,australian parliament gathers to discuss dwindling hemsworth reserves
7167,new custard could cause worldwide flandemic
7168,ham glazed to dangerously delicious levels
7169,usa today crossword puzzle grants false sense of intelligence
7170,dead deer by side of road covered in graffiti
7171,10th-grade prodigy studying mathematics at 10th-grade level
7172,oscars committee announces plan to shorten ceremony to single-millisecond flash of blinding white light
7173,area man takes metallica audio tour of art museum
7174,mel gibson - his performance in 'payback' still not getting enough credit
7175,rich first-grader buys whole sheet of gold stars
7176,historical archives: a jest for you
7177,"poll: 80 percent of americans in favor of storming castle, destroying inhuman monster"
7178,tearful meghan mccain opens up about father's dying wish that she be given her own daytime talk show
7179,"parents, baby, godmother all uncomfortable with arrangement"
7180,cleveland ukrainian museum pulling out all stops to prepare for onrush of rnc visitors
7181,child promised he can go right back to video game after giving dying grandfather one last hug
7182,onion social announces hiring of james damore as chief technology officer
7183,rain-drenched cat announces it ready to stay inside and be part of family
7184,"1999 collaboration between carlos santana, rob thomas somehow standing test of time"
7185,indian casino uses every part of the dollar
7186,ted cruz provides detailed response to moderator's question about why his face so fucking infuriating
7187,gop leaders move goalposts on opposing trump to him being filmed masturbating on u.s. flag in arlington cemetery
7188,djimon hounsou to play every african in the world
7189,lawyers confirm trump willing to answer all of sean hannity's questions about russia collusion
7190,divorced man sadly removes ex-wife's admin privileges from home security system
7191,naïve detective suspects fair play
7192,scientists announce shrimp just as dumb as they thought
7193,entertainment writer has knack for making complex pop culture concepts accessible to lay readers
7194,historians uncover evidence stonehenge once prominent druid make-out spot
7195,breaking: lovers lost in fog
7196,sun-dried sparrow carcass washed away with hose
7197,pope francis hastily condemns capital punishment after vatican police announce new evidence found in 2014 stabbing
7198,carlos santana surprises wife with coupon for free 45-minute guitar solo
7199,new 'game of thrones' trailer reveals final season will be cobbled together from old footage
7200,stack of unused cd-rs turns five
7201,man in political argument clearly just regurgitating monologue from 'henry v'
7202,sperm can't remember why it came into womb
7203,nation's boyfriends dreading 'free event in the park' season
7204,'game of thrones' actors reveal reading script for zombie battle and realizing they wasted careers
7205,"area woman not yelling at you, she's just saying"
7206,fox voluntarily removes reality from programming
7207,study: you have hpv
7208,ponds institute tops 1997 cosmopolitan college poll
7209,sony unveils matte-black box of red and green lights
7210,blood-soaked mayor bloomberg announces homelessness no longer a problem in new york city
7211,report: average american has just 20% of what it takes
7212,school friends don't find camp songs funny
7213,siblings gather around powerpoint to hash out off-limits topics for thanksgiving
7214,baby-shower attendees quickly drain box of white zinfandel
7215,news van driver sick of helping anchors move
7216,giant bass hates having picture taken
7217,astronomers discover extremely graphic galaxy
7218,aspiring legislator keeps sending unsolicited bills to house of representatives
7219,vagina medicine left out where anyone can see it
7220,trump casually mills about supreme court changing rooms ahead of state of the union address
7221,newly discovered journal entries reveal sacagawea's repeated attempts to ditch lewis and clark
7223,dog feels like he always has to be 'on' around family
7224,labor secretary letting 8 million unemployed americans crash at his place until they get back on their feet
7225,paul ryan slits auto mechanic's throat to kick off gop purge of working class
7226,pictures of smiling group of people taken where john lennon was murdered
7227,christie 2016 comes from nowhere to win republican nomination
7228,white house infested with bedbugs after biden brings in recliner off the curb
7229,earth passed over for invasion
7230,entertainment lawyer 'fighting the good fight'
7231,temp replaced with cheaper temp
7232,"girlfriend, girlfriend's brother look way too much alike"
7233,name of gay bar should have been clearer
7234,new statewide education standards require teachers to forever change lives of 30% of students
7235,blood drains from mueller's face after realizing russia investigation might go all the way to white house
7236,woman already off to bad start as mother after requesting epidural
7237,area man may never find out if condom in wallet is still good
7238,"sports bar makes more room for tvs by getting rid of tables, chairs, bartenders, customers"
7239,moving to new city to solve all of area man's problems
7240,inspirational disabled horse crosses preakness finish line after 11 hours
7241,usa original movie not that original
7242,concerned text from mom ​gleefully ​mocked like ramblings of village idiot
7243,gummy bears born conjoined
7244,washington monument set up on blind date with eiffel tower
7245,study suggests onion social notifications 300 times more satisfying to receive than facebook notifications
7246,intact benetton shirt miraculously pulled from bangladesh rubble weeks later
7247,"barbara bush passes away surrounded by loved ones, jeb"
7248,nbc cancels 'piven' after 5 seasons
7249,fantasized argument getting pretty intense
7250,therapist beginning to show cracks in caring façade
7252,doctor informs woman she pregnant as hell
7253,government report on illiteracy copied straight from encyclopedia
7254,area cockroach fucking huge
7255,man has never given single definitive yes to any invitation he's ever received
7256,bad-ass engagement ring also tells the time and temperature
7257,report: more americans turning to louder sources for their news
7258,shape magazine declares july 'let yourself go' month
7259,cocky attempt to operate atm in spanish backfires
7261,liberal feels like idiot for placing entirety of hopes on mueller probe instead of new york prosecutors' investigation
7262,guy in audience shouts out perfect thing
7263,yankee candle clarifies that product only intended to be dripped on balls
7264,impatient raytheon declares war on north korea
7265,partygoer rolls a couple of fat burritos to pass around
7266,new 'call of duty' career mode lets player join raytheon's board of directors after military service
7267,so-called professional gamer not even racist
7268,new study finds women should only be making 20 cents less on dollar than men
7269,nation's sound engineers gather to talk about their ponytails
7270,warning on police body camera footage cautions viewer they about to see pretty much exactly what they'd expect
7271,'us weekly' wins pulitzer for outstanding achievement in photoshopping a rip between divorced celebrity couple
7272,obama begins state of the union by asking congress to imagine newt gingrich standing before them
7273,"friends, family waiting for current bout of man's depression to subside before really laying into him"
7274,area man seated next to lou reed on roller coaster
7275,pueblo indians can't keep pace with area mom's appetite for earthenware
7276,levi's unveils new line of jeans with size written across the whole ass
